,0
700,"The Princess of Wales chatted to the soldier while handing him a shamrock sprig, ignoring the rain pattering down"
701,The hard-working Princess of Wales beamed as she handed over the shamrock sprig to the soldier
702,The Princess of Wales was a bright flash of colour as she stepped out of the car against a grey background
703,Princess of Wales
704,The Princess of Wales looked radiant in teal as she arrived at the St Patrick's Day Parade in Aldershot this morning on her first event since becoming colonel of the Irish Guards
705,Kate Middleton - who has previously admitted she was a 'terrible' waitress - pictured at her graduation ceremony in June 2005
706,Meg Bellamy in character as the Princess of Wales
707,Meg Bellamy in character as the Princess of Wales
708,Meg Bellamy in character as the Princess of Wales
709,Meg Bellamy in character as the Princess of Wales
710,Ed McVey and Meg Bellamy filmed a scene thought to involve one of the Princess of Wales' former flames on the set of The Crown's sixth series in St Andrews yesterday
711,"Prince George (left), nine, and his sister Princess Charlotte (centre), who will turn eight shortly before the ceremony, and Prince Louis (bottom right), who will turn five in April, will attend. The three siblings are pictured last year with their parents the Prince and Princess of Wales"
712,"In the candid conversation, William said his mother, Diana, the Princess of Wales (pictured together in 1985), had been invested in tackling the problem throughout her life"
713,ALDERSHOT: The Prince and Princess of Wales each enjoyed a pint of Guinness
714,"You may have seen that the Princess of Wales attended this year¿s Baftas wearing a dress by Alexander McQueen that she first wore to the awards in 2019, this time with an altered shoulder detail, and some gold chandelier earrings that cost £17.99"
715,"Diana, Princess of Wales, and her companion Dodi Fayed, walk on a pontoon in the French Riviera resort of St Tropez on August 22, 1997. The pair both died days after this photo was taken in a crash in Paris"
716,"Actor Ed McVey, as Prince William and actress Meg Bellamy who plays Kate Middleton are seen during filming for the next season of The Crown at St Andrews on Friday"
717,"The Prince and Princess of Wales' post has already amassed 90,000 likes and fans rushed to gush over the sweet images"
718,"People have commented on how 'sweet' Meg, who plays Kate Middleton, has been to students, and shared a clip of their interaction"
719,"The Princess of Wales, 41, is given blonde highlights in the video and her hair piled on top of her head in a messy bun. Becca then went to town on Kate's make up, plastering her face in fake tan, and giving her the 90s foundation lips"
720,The Prince and Princess of Wales released two new family photos to mark Mother's Day today - including this image of Kate and the children posing in a tree on the Sandringham estate
721,Judi James says Prince Louis was the child Kate Middleton 'tende to carry the most'. The family pictured on the Buckingham Palace balcony in June 2019
722,Judi James says the Princess of Wales may have some sadness about losing the 'constant mother/baby contact' with her youngest son. Kate and Louis pictured in June 2022
723,"The Prince and Princess of Wales' post has already amassed 90,000 likes and fans rushed to gush over the sweet images"
724,Jessica pictured arriving with her daughter Isabel at St George's Chapel for Meghan Markle and Prince Harry's wedding with the Princess of Wales and Princess Charlotte
725,"The royals showed off their love of high-street fashion in this snap shared by the family on Instagram to mark Mother's Day (pictured L-R: Prince Louis, the Princess of Wales, Prince George, Princess Charlotte)"
726,Eagle-eyed royal fans spotted Kate Middleton in the newly surfaced pictures of James' French nuptials
727,The Princess of Wales proved she is the queen of business chic today as she brought together some of the biggest firms in the UK to create a new ¿taskforce¿ to back her campaign to prioritise early childhood
728,"Run by business, for business, Kensington Palace said the business taskforce will play an 'essential role' in the Princess of Wales' work to transform the way in which society prioritises and supports children in their earliest years"
729,"Since taking on her new title as Princess of Wales, Kate has made sure one thing has remained at the top of her priority list - the mental health of younger generations in the UK"
730,"The Princess of Wales has partnered up with businesses including NatWest, Unilever, Aviva, Deloitte, IKEA, Co-op, The LEGO Group and Iceland for her new Early Years 'taskforce'. Pictured visiting a primary school in 2022"
731,"The Princess of Wales pictured in Port Talbot in February 2023. The Chief Executive of the Royal Foundation said: 'We all have a role to play in building a supportive and nurturing world around children and those who care for them, and it is fantastic to see business leaders placing the subject of early childhood at the heart of their organisations'"
732,"Zara earrings have got a proven red carpet record - the Princess of Wales accessorised her Alexander McQueen gown with Zara¿s floral danglers, faux pearls included, at the Baftas last month. Kate¿s £17.99 earrings"
733,The couple pictured with the Prince and Princess of Wales at Windsor Castle during their royal tour of the UK earlier this month
734,"Lady Margarita was famously one of Kate Middleton 's four flower girls at her 2011 wedding to Prince William - alongside Prince William's goddaughter Grace van Cutsem, the groom's cousin Lady Louise Windsor and the Queen Consort's granddaughter Eliza Lopes"
735,"The Princess of Wales, 41, made a surprise appearance at Iceland in Aylesbury, Buckinghamshire, as part of her work on the Shaping Us campaign from her Royal Foundation Centre for Early Childhood"
736,The royal love map: Prince William and Kate Middleton's favourite haunts during their uni years
737,University sweethearts: Prince William and Kate Middleton on the day of their graduation ceremony at St Andrews University in June 2005. The couple met as freshers four years prior
738,Prince William (played by Ed McVey) gazes at Kate Middleton (played by Meg Bellamy) as she walks past him on the set of season six of The Crown
739,Meg Bellamy playing Kate Middleton during filming in St Andrews for the sixth series of The Crown
740,The Prince and Princess of Wales's alma mata - The University of St Andrews in Scotland
741,Kate Middleton at her graduation ceremony at St Andrews in June 2005
742,"Kate Middleton at a charity fashion show at St Andrews in 2002. Her catwalk strut proved to be one of the most defining of her life, when she moved the young Prince William to exclaim: 'Wow, Kate's hot'"
743,Kate Middleton with friends at St Andrews as Prince William plays in a rugby sevens tournament in April 2005
744,Kate Middleton said Prince William tried to woo her with his cooking skills while they were at university together. Pictured: The couple with Mary Berry on the set of A Berry Royal Christmas in 2019
745,Prince William and Kate Middleton ordered a fish supper before returning for ice cream
746,Kate Middleton launched her Business Taskforce for Early Childhood this week
747,The Princess of Wales  urged business leaders to prioritise wellbeing in the workplace to support family life
748,"Princess of Wales -front row centre-  with, front row from left, Deloitte's Global Lead Executive Insight and Experience, Jolyon Barker, Aviva Group CEO, Amanda Blanc, LEGO Group's General Manager, UK & Ireland, Christian Pau, and Co-Op CEO Shirine Khoury-Haq, and back row from left, Coutts' CEO of Wealth Business, Peter Flavel, Elizabeth Fagan, NatWest CEO, Alison Rose, Trustee of The Royal Foundation of The Prince and Princess of Wales, Ron Khalifa, Former President of the CBI, Karan Bilimoria, UK CEO of IKEA UK and Ireland, Peter Jelkeby, The Royal Foundation of The Prince and Princess of Wales CEO, Amanda Berry and Head of Unilever UK, Richard Sharp on March, 21"
749,Kate Middleton
750,Details about Kate Middleton's childhood crush on Prince William came to light in 2019
751,The Prince and Princess of Wales tied the knot in Westminster Abbey wedding in April 2011
752,Charles Spencer's daughters also attended the wedding of Prince William and Kate Middleton
753,Prince Louis completely eclipsed events once again just days later when he sat next to mother Kate Middleton in the Royal Box at the Platinum Jubilee Pageant in London
754,Hannah Cockburn-Logie (centre) the former private secretary to the Prince and Princess of Wales
755,"The 1934 royal wedding between Prince George, Duke of Kent, and Princess Marina of Greece and Denmark. L-R, Princess Katherine of Greece, Lady Iris Mountbatten, the Princess of Wales, Princess Eugenie of Greece, the Duchess of Kent, the grand Duchess Kyra of Russia, the Duke of York, Princess Irene of Greece, Princess Julianna of the Netherlands. Seated Lady Mary Cambridge and Princess Elizabeth"
756,"At the wedding, the stylist was given a starring role as she entered St George's Chapel alongside the Princess of Wales"
757,"Kate Middleton (L) and Emma Sayle (R) pictured together, lunching in West London"
758,Has Netflix drama The Crown slashed its budget to tell the tale of Kate Middleton and Prince William when they were thrifty students?
759,"Sources say that, like in previous years (the Princess of Wales pictured in 2022 with Novak Djokovic) Kate will present the trophy - including to Russian and Belarusian players"
760,"The Princess of Wales (left) pictured with her eldest son, Prince George, at Wimbledon in July 2022"
761,"The Prince and Princess of Wales (pictured together on March 17), are away with their children, who have already broken up from school for Easter"
762,"Confidante: Former royal butler Paul, 64, worked beside and was a confidante of Diana, Princess of Wales, for ten years until her death in 1997 (pictured together in August that year)"
763,The Princess of Wales wore a similar pair of black opera gloves to attend the 2023 BAFTAs last month
764,"Life: A former girlfriend of the Princess of Wales's brother, James Middleton, Donna has a daughter with casino and wildlife park owner Damian Aspinall"
765,The Queen Consort paid a touching tribute to Prince William and Kate Middleton today as she started the second day of her royal tour in Germany
766,The royal wore the dazzling diamond brooch to the Prince and Princess of Wales' wedding in 2011
767,"The Princess of Wales is known for being an active mother who stresses the importance of the outdoors for children. So how will the Wales family be spending their down time during the Easter school holidays? FEMAIL explores how Kate and William spend their leisure time with Prince George, nine, Princess Charlotte, seven and Prince Louis, four"
768,To celebrate their 10th wedding anniversary in 2021 the Prince and Princess of Wales released a video of the family enjoying activities outdoors including toasting marshmallows on the fire
769,Ahead of Queen Elizabeth's Platinum Jubilee celebrations last summer the Princess of Wales got busy in the kitchen with her children and made a batch of cupcakes for a street party
770,Carole and Kate Middleton pictured shopping in Chelsea in 2006
771,Smitten: Ed McVey and Meg Bellamy looked loved-up as they transformed into Prince William and Kate Middleton to film series six of The Crown
772,"Love story: It was during his time at St Andrews that Prince William met and fell in love with fellow student Kate, now the Princess of Wales (pictured together on their graduation day)"
773,"Announcing the casting on Instagram last September, she wrote: 'Pinch me please... So excited to announce that I will be playing Kate Middleton in Series 6 of Netflix's The Crown'"
774,Stardom: Meg's rise is set to be meteoric after she was plucked from obscurity to play the Princess of Wales when she submitted a self-taped audition to the makers of the show after seeing the role advertised on social media
775,"Impressive: At school, it seems both the Princess of Wales and the actress playing her were model pupils"
776,"The Prince and Princess of Wales sent a snap of their family in Sandringham on Christmas Day and a thank you note to a well-wisher, who had sent them a card last December"
777,"The card came with a note from Prince William and Kate Middleton, thanking the fan for their kind wishes"
778,The royal fan said the response from the Prince and Princess of Wales and their family was a 'lovely surprise'
779,Kate Middleton pictured getting in her VW Golf before heading off to a local petrol station to fill up
780,"In 2005, Prince William was photographed behind the wheel of then-girlfriend Kate Middleton's VW Golf hatchback"
781,"Confidante: Former royal butler Paul, 64, worked beside and was a confidante of Diana, Princess of Wales, for ten years until her death in 1997 (pictured together in August that year)"
782,Kate Middleton's uncle shows off his new distinguished look in Central London
783,"Prince William, 40 - who is next in line to the throne - will be there with his wife, Kate Middleton, 41, and their three kids, George, nine, Charlotte, eight, and Louis, five"
784,The Prince and Princess of Wales have praised Dame Deborah James' (pictured with Prince William) 'incredible legacy' after more than £11million was raised for her Bowelbabe Fund
785,The Princess of Wales chatted with Mr Walker in a branch of the supermarket in Aylesbury
786,"The acorns at the bottom of the page could be a sweet nod to the Princess of Wales, whose coat of arms reflects oak"
787,Prince Louis delighted royal fans with his animated outbursts during the Platinum Jubilee celebrations last summer. Pictured enjoying a performance at the Platinum Jubilee Pageant with the Princess of Wales
788,Kensington Palace is the official London resident of the Prince and Princess of Wales
789,The Princess of Wales took inspiration from Diana in 2018 when she sported a similar Smythe blazer
790,"Iceland boss Richard Walker, 42, who was praised by the Princess of Wales for being 'super fit' ahead of his charity climb of Mount Everest, is incredibly active in his private life and celebrated his 40th birthday surfing in Cornwall (pictured)"
791,The Princess of Wales chatted with Mr Walker in a branch of the supermarket in Aylesbury
792,Mr Walker (pictured) chatted to the Princess of Wales about the Shaping Us campaign as part of her early years crusade
793,Kensington Palace is the official London resident of the Prince and Princess of Wales
794,The Prince and Princess of Wales and the Duke and Duchess of Sussex visit floral tributes and meet members of the public at Windsor Castle
795,Cruise met Prince William and Kate Middleton at the Top Gun: Maverick screening
796,The Prince and Princess of Wales and the Duke and Duchess of Sussex visit floral tributes and meet members of the public at Windsor Castle
797,"As is tradition, it is expected the royals, such as King Charles and Queen Consort Camilla, as well as the Prince and Princess of Wales (pictured with Prince George and Princess Charlotte on Easter Sunday 2022), will gather together in Windsor for the holiday weekend"
798,"Prince William, 40 - who is next in line to the throne - will be there with his wife, Kate Middleton, 41, and their three kids, George, nine, Charlotte, eight, and Louis, five"
799,The Prince and Princess of Wales and the Duke and Duchess of Sussex visit floral tributes and meet members of the public at Windsor Castle
800,The Princess of Wales rocking the camo look in the snow while meeting the 1st Battalion Irish Guards in Salisbury in March
801,"In March 2020, Prince Edward was praised for diffusing any possible tension as he took his seat between the Sussexes and the Prince and Princess of Wales at the Commonwealth Day service that year (pictured)"
802,The Princess of Wales added an unusual splash of colour to her fingertips as she attended the Easter Mattins in Windsor today
803,Princess Charlotte was the Princess of Wales's mini-me as they left the Easter Sunday service at Windsor Castle together
804,The Prince and Princess of Wales have arrived with all three of their children at St George's Chapel at Windsor Castle for the first Easter Sunday service of King Charles's reign
805,The Prince and Princess of Wales have arrived with all three of their children at St George's Chapel at Windsor Castle for the first Easter Sunday service of King Charles's reign
806,"Four-year-old Prince Louis looked on at the crowd in curiosity as he held his mother, the Princess of Wales' hand"
807,Princess of Wales receives flowers from eight-year-old Samuel after the service today
808,The Prince and Princess of Wales have arrived with all three of their children at St George's Chapel at Windsor Castle for the first Easter Sunday service of King Charles's reign
809,"The Princess of Wales is pictured with her youngest son Prince Louis, who is joining the royals on their Easter Sunday Service for the first time"
810,The Princess of Wales is pictured holding her daughter Princess Charlotte's jacket as they head out from the service for Easter Sunday
811,The Princess of Wales holds hands with Princess Charlotte as they leave on Sunday
812,The Princess of Wales looked elegant as always as she proudly arrived at the Sunday Service with her family
813,"Four-year-old Prince Louis looked on at the crowd in curiosity as he held his mother, the Princess of Wales' hand"
814,"The Prince and Princess of Wales pictured with their three children Prince George, Princess Charlotte and Prince Louis attending the service"
815,Richard Walker (right) with the Princess of Wales. He is campaigning to raise awareness about a rare form of Alzheimer's
816,"Prince George was joined at St George's Chapel in Windsor Castle by his father and mother, the Prince and Princess of Wales, as well as his siblings, Princess Charlotte, seven, and Prince Louis, four"
817,Princess Charlotte was the Princess of Wales's mini-me as they left the Easter Sunday service at Windsor Castle together
818,"Senior members of the Royal Family arrived at St George's Chapel in Windsor for their Easter Sunday service dressed in different shades of blue. Pictured: The Prince and Princess of Wales with Prince George, nine, Princess Charlotte, seven and Prince Louis, four"
819,"The Princess of Wales' only daughter, seven, looked darling in a blue floral dress from British designer Rachel Riley, priced at £65 as the royal family attended the Easter Mattins Service at Windsor Castle yesterday"
820,"Kate Middleton and Meghan Markle have had issues in the past, detailed in Harry's memoir Spare"
821,Royal experts have suggested that an appearance by Meghan would have made the Princess of Wales (right) 'uncomfortable'
822,'The Princess of Wales (left) in particular is delighted she won't have to face her treacherous sister-in-law (right) at the King's Coronation next month'
823,"Kate Middleton and Meghan Markle have had issues in the past, detailed in Harry's memoir Spare"
824,Royal experts have suggested that an appearance by Meghan would have made the Princess of Wales (right) 'uncomfortable'
825,"The Princess of Wales, pictured on Easter Sunday with Prince Louis, would have been 'particularly uncomfortable' if Meghan had attended the Coronation, a royal observer has claimed"
826,The Princess of Wales wore a royal blue Catherine Walker coat for the Easter Sunday service this year
827,Royal experts suggested an appearance by Meghan would have been particularly 'uncomfortable' for the Princess of Wales.
828,"Kate Middleton and Meghan Markle have had issues in the past, detailed in Harry's memoir"
829,Royal experts have suggested that an appearance by Meghan would have made the Princess of Wales 'uncomfortable'
830,"The Princess of Wales¿s great-great-great-great-great-aunt, Norfolk-born Harriet Martineau, became known as ¿the greatest American abolitionist¿"
831,The Daily Mail can reveal that the ancestor of the  Princess of Wales played a key role in the movement that led to the abolition of slavery
832,"The Princess of Wales' ancestor was instrumental in helping two slaves from Georgia, who had managed to flee the state in disguise before emigrating to England"
833,"Claudia Joseph spoke to four women who were born on January, 9, 1982, the same day as the Princess of Wales (pictured), to see how their lives compare"
834,"Kate Haigh (pictured), 41, not only shares the Princess of Wales's birthday but also her name"
835,"Julia Gray (right), the daughter of the former PM's father Stanley Johnson, was also born on the same day as the Princess of Wales"
836,"Lavish: Binky is preparing to welcome her third child at the Lindo Wing, where Kate Middleton, Princess of Wales, welcomed Prince George, Princess Charlotte (pictured) and Prince Louis"
837,"And remember: spring is the season of layers and finding just the right thing - not too heavy, not too light - to go on top. Pictured: Kate, Princess of Wales"
838,"The late Diana, Princess of Wales and Jemima Khan (left) during their visit to Imran Khan's cancer hospital in Lahore, Pakistan in April 1996"
839,"Career: Paul was the former butler to Diana, Princess of Wales (pictured holding a painting of her)"
840,The Prince and Princess of Wales (pictured on St Patrick's Day) are set to visit Birmingham this week where they will meet with leading figures in the creative and arts industries
841,The Princess of Wales - pictured at the Queen's funeral - has reportedly 'built up resentment' because she was forced to stay back while Royal Family members rushed to Balmoral last year
842,"Catherine, Princess of Wales, Prince William, Prince of Wales, Prince Harry, Duke of Sussex, and Meghan, Duchess of Sussex, on the Long Walk at Windsor Castle to greet well-wishers"
843,"Fit for Royalty: The Prince and Princess of Wales welcomed their third child, Prince Louis in April 2018 on the wing, weighing 8lbs 7oz, on St George's Day"
844,"Luxury: Binky welcomed her third child at the Lindo Wing, where Kate Middleton, Princess of Wales, welcomed Prince George, Princess Charlotte and Prince Louis"
845,17. An image of Kate Middleton's side profile in an apparent photo shoot
846,"The Duke of Edinburgh, Prince William, Earl Spencer, Prince Harry and the Prince of Wales follow the coffin of Diana, Princess of Wales, to Westminster Abbey on September 6, 1997"
847,"ITVX's The Real Crown: Inside the House of Windsor, which has been released today, dedicated its fourth episode to exploring Her late Majesty's (pictured with Diana in 1986) decisions following the passing of the then Princess of Wales in 1997"
848,"The Duke of Edinburgh, Prince William, Earl Spencer, Prince Harry and the Prince of Wales follow the coffin of Diana, Princess of Wales, to Westminster Abbey on September 6, 1997"
849,"ITVX's The Real Crown: Inside the House of Windsor, which has been released today, dedicated its fourth episode to exploring Her late Majesty's (pictured with Diana in 1986) decisions following the passing of the then Princess of Wales in 1997"
850,"The Queen arrives at the funeral service for Diana, Princess of Wales, at Westminster Abbey, on September 6, 1997"
851,"Princess of Wales tries her hands making Indian street food. She said she loves spice, but William said he preferred milder food, adding: 'I'm a masala man'"
852,"The Princess of Wales with Alison Hammond during a visit to The Rectory, Birmingham, to meet future leaders and local business owners from Birmingham's creative industries sector"
853,"The Princess of Wales with Alison Hammond during a visit to The Rectory, Birmingham, to meet future leaders and local business owners from Birmingham's creative industries sector"
854,"The Princess of Wales, pictured, also took part in a game of interactive darts in the 180 Club during a visit to The Rectory, in Birmingham, later in the day"
855,"The Princess of Wales celebrates Birmingham's rich Asian culture during a visit to the Indian Streatery, an authentic, family run independent Indian restaurant based in the city centre"
856,The Princess of Wales at The Indian Streatery in Birmingham
857,The Princess of Wales is all smiles as she waves at crowds ahead of visiting The Rectory in Birmingham
858,The Princess of Wales is all smiles as she waves at crowds ahead of visiting The Rectory in Birmingham
859,The Princess of Wales speaks with members of the public following a visit to The Rectory in Birmingham
860,"The Prince and Princess of Wales remain enduringly popular and have even increased their share of support, particularly when compared to Harry and Meghan (pictured)"
861,The Princess of Wales and Duchess of Sussex pictured at the Wimbledon final in June 2018. Royal expert Tessa Dunlop has said the two royal wives had a 'frosty but polite' relationship
862,The Princess of Wales and Duchess of Sussex pictured together on Christmas Day in 2018. Royal expert Tessa Dunlop said Kate and Meghan were like 'inverted versions of each other'
863,The Prince and Princess of Wales with Prince George and Princess Charlotte at Meghan Markle and Prince Harry's wedding
864,"The Princess of Wales, pictured, also took part in a game of interactive darts in the 180 Club during a visit to The Rectory, in Birmingham, later in the day"
865,Princess of Wales
866,Princess of Wales
867,"Strike a pose! The Prince and Princess of Wales pose for a selfie with This Morning presenter, Alison Hammond"
868,Sharing a laugh! The Prince and Princess of Wales were left giggling after William's phone call
869,"The Princess of Wales celebrates Birmingham's rich Asian culture during a visit to the Indian Streatery, an authentic, family run independent Indian restaurant based in the city centre"
