,0
0,"The relationship between the Prince of Wales and his estranged brother is 'hanging by a thread' ahead of the publication of Harry's tell-all memoir. Pictured: The Duke of Sussex and Duke of Cambridge during the unveiling of a statue they commissioned of their mother Diana, Princess of Wales, in the Sunken Garden at Kensington Palace, on what would have been her 60th birthday on July 1, 2021"
1,"The Prince and Princess of Wales, along with their children George, Charlotte and Louis, speak with a member of the public outside St Mary Magdalene Church in Sandringham on Christmas Day"
2,"Prince William, Prince of Wales and Catherine, Princess of Wales with Prince George of Wales, Princess Charlotte of Wales and Prince Louis of Wales attend the Christmas Day service at St Mary Magdalene Church"
3,Pictured: Princess of Wales
4,Pictured: Princess of Wales
5,The teacher now steps into work wearing clothing that have been worn by The Princess of Wales. Laurie is pictured here wearing the LK Bennett Phelia dress which retails for £249
6,"Kate Middleton looked elegant in the Whistles blouse as she cuddled up to her then fiancé Prince William in photographs taken at St James's Palace, London, in November 2010"
7,"Former tennis player Martina Navratilova (left) sits next to Kate, now the Princess of Wales, and Meghan Markle, the Duchess of Sussex in the Royal Box at Wimbledon ahead of the final between Serena Williams of the U.S. and Romania's Simona Halep in July 2019"
8,The Prince and Princess of Wales have enjoyed a family outing to Lapland UK with their two eldest Prince George and Princess Charlotte (pictured together on Christmas Day)
9,"Together at Christmas, which featured the carol concert organised by the Princess of Wales on Thursday, December 15, took place in Westminster Abbey"
10,Ms Navratilova (left) sits next to the Princess of Wales and the Duchess of Sussex in the Royal Box at Wimbledon to watch the 2019 women's final
11,"It comes as Harry has said he would 'like to have my father and brother back' as he launched a publicity blitz for his memoir this week. Harry pictured with his wife, brother and Kate Middleton in 2018"
12,"Former tennis player Martina Navratilova (left) sits next to Kate, now the Princess of Wales, and Meghan Markle, the Duchess of Sussex in the Royal Box at Wimbledon ahead of the final between Serena Williams of the U.S. and Romania's Simona Halep in July 2019"
13,The Duke of Cambridge was once so close with Tom Bradby that he was chosen to conduct the November 2010 engagement exclusive interview with him and Kate Middleton
14,Prince Harry claims in his new biography Spare that the Prince and Princess of Wales encouraged him to wear a Nazi costume to a 2005 fancy dress party. The trio pictured in 2016
15,Prince Harry said he was 'delighted' about the engagement of Prince William and Kate Middleton following the announcement in November 2010 - and said the marriage meant he was 'gaining a sister he had never had'
16,"The Duke and Duchess of Cambridge and Prince Harry visited the White Garden in Kensington Palace, London, as they meet with representatives from charities supported by Diana, the Princess of Wales in August 2017"
17,Prince Harry appeared to talk with Kate Middleton as they left the service at St George's Chapel in 2021
18,"Kate Middleton is said to have 'burst into tears' during a bridesmaid fitting  for Charlotte ahead of Prince Harry and Meghan Markle's wedding after a series of disagreements with the Duchess of Sussex, it has been claimed."
19,Pia Whitesell has branded Prince Harry 'ridiculous' after he blamed Prince William and sister-in-law Kate Middleton for his notorious appearance at a costume party wearing a Nazi uniform in 2005.
20,"Harry - seen here with William at an unveiling of a statue dedicated to their mother, Diana, Princess of Wales, in 2021 - asked Will and Kate for advice on whether to wear a Nazi uniform or a pilot uniform to the party"
21,Bradby interviewed Prince and Princess of Wales when their engagement was announced in November 2010
22,The Duke of Sussex writes in his bombshell memoirs Spare that he also wanted the inquiry into the Princess of Wales's fatal accident to be reopened
23,The Prince and Princess of Wales and the Duke and Duchess of Sussex pictured together at the Commonwealth Service at Westminster Abbey in March 2019
24,"The two-bedroom Nott Cott, which was both Harry and Meghan and the Prince and Princess of Wales's first marital home, was described as 'so small' by Meghan in her recent Netflix series"
25,"The King and Queen Consort wanted the Princess of Wales to change the way she spelt her name, Harry claims in his memoir"
26,"The Princess of Wales, patron of addiction recovery charity The Forward Trust, said addiction is 'a serious health condition' and 'not a choice'"
27,Harry is seen with his brother and the Princess of Wales at the Rugby World Cup in 2015
28,"According to Harry, after he and Meghan returned from their honeymoon, the Prince and Princess of Wales invited Harry and Meghan to their flat at Kensington Palace after the rows"
29,"The island on the Althorp estate, Northamptonshire, where Diana, Princess of Wales, was laid to rest"
30,"According to Harry, after he and Meghan returned from their honeymoon, the Prince and Princess of Wales invited Harry and Meghan to their flat at Kensington Palace after the rows"
31,Another leak revealed that Harry (right) has laid some of the blame on William (left) and Kate Middleton for his notorious appearance in a Nazi uniform at a 2005 costume party
32,Prince Harry walks alongside Meghan and the Princess of Wales at the lying-in-state of the Queen last year
33,"Yesterday, Mr Benton offered his gratitude to The Prince and Princess of Wales tweeting that they were the 'epitome of decency and class'"
34,"The condition is perhaps best known for affecting Catherine (above in April 2013), Princess of Wales, who was hospitalised for several days in 2013 while pregnant with her first child, Prince George"
35,"Undated handout screengrab issued by ITV of Prince Harry and Prince William meeting mourners following the death of their mother Diana, Princess of Wales in 1997"
36,"Undated handout screengrab issued by ITV of Prince Harry (left) and Prince William meeting mourners following the death of their mother Diana, Princess of Wales in 1997"
37,"Undated handout screengrab issued by ITV of Prince Harry and Prince William meeting mourners following the death of their mother Diana, Princess of Wales in 1997"
38,Prince and Princess of Wales got married on April 29 in 2011 at Westminster Abbey
39,Prince William has know Mr Van Straubenzee since childhood where he attended Ludgrove School in Berkshire. They are pictured with Kate Middleton in 2016 at Ascot Racecourse
40,Prince Harry saw the Princess of Wales as the sister he 'never had' - but has accused his family of 'stereotyping' his wife Meghan Markle. Above: Harry stands next to Kate and his brother on the Buckingham Palace balcony in 2013
41,Harry is seen with his brother and the Princess of Wales at the Rugby World Cup in 2015
42,"The Princess of Wales' gorgeous brunette locks cascade over her shoulders and down her back. She often wears her hair straight, in buoyant waves tucked behind her ears"
43,"It is safe to assume that, right now, Princess Charlotte's mother Kate Middleton is responsible for her cute plaits (pictured) and curls"
44,"Prince William, Prince George, Princess Charlotte and Kate Middleton visiting Cardiff Castle together in the summer"
45,Princess of Wales Princess Charlotte arriving for a Service of Thanksgiving for the life of the Duke of Edinburgh
46,"The Prince and Princess of Wales with their three children, Prince George, Princess Charlotte and Prince Louis"
47,Harry has spoken about the rift between his wife Meghan Markle (pictured) and his sister-in-law the Princess of Wales
48,"Undated handout screengrab issued by ITV of Prince Harry and Prince William meeting mourners following the death of their mother Diana, Princess of Wales in 1997"
49,"In his explosive memoir, Harry claims his wife Meghan Markle was left 'on the floor sobbing' by a row with her sister-in-law Kate Middleton over Princess Charlotte's bridesmaid's dresses"
50,Prince Harry told Tom Bradby that the Princess of Wales was among members of the Royal Family who 'stereotyped' his wife Meghan Markle when they first started dating
51,The Princess of Wales and Duchess of Sussex at the Wimbledon women's singles final together in 2019
52,King Charles and Camilla have shared their best wishes with the Princess of Wales as she marks her 41st birthday today - as Prince Harry released a series of bombshell interviews overnight
53,Prince Harry has claimed the Princess of Wales was among the members of his family who 'stereotyped' his wife Meghan. The royal wives are pictured in June 2018
54,Prince Harry told Tom Bradby that the Princess of Wales was among members of the Royal Family who 'stereotyped' his wife Meghan Markle when they first started dating
55,The Princess of Wales and Duchess of Sussex at the Wimbledon women's singles final together in 2019
56,Prince Harry told Tom Bradby that he felt 'slightly awkward' being a 'third wheel' to Prince William and Kate Middleton before meeting Meghan. The trio pictured in 2012
57,The Princess of Wales and Duchess of Sussex pictured at the Wimbledon women's singles final in 2018. Prince Harry says William called Meghan 'rude' for accusing his wife of having 'baby brain'
58,"For their second Wimbledon appearance together in 2019, the Princess of Wales and Duchess of Sussex were joined by Kate's sister Pippa Middleton"
59,Prince Harry said that Prince William wouldn't let the issue go because he hadn't been allowed to have facial hair for his own wedding to Kate Middleton in 2011 (pictured)
60,The Duke of Cambridge was once so close with Tom Bradby that he was chosen to conduct the November 2010 engagement exclusive interview with him and Kate Middleton
61,King Charles and Camilla have shared their best wishes with the Princess of Wales as she marks her 41st birthday today - as Prince Harry released a series of bombshell interviews overnight
62,"Harry told host Anderson Cooper that he texted his brother, Prince William, 40, to see how he and his wife, Kate Middleton, 41, were going to get to the estate, located in Aberdeenshire, Scotland, but that he was never given the flight details"
63,"It also includes claims the Prince of Wales physically attacked Harry and teased him about his panic attacks, and that the King put his own interests above Harry's and was jealous of the Duchess of Sussex and the Princess of Wales. (Pictured: Harry and William at Buckingham Palace on July 10, 2018)"
64,"She and her equally glamorous younger sister, Amy, once dolled themselves up in spoof tiaras and offered fitness classes which culminated in lifting a 10kg dumb-bell (¿the weight of an average royal corgi¿) before Prince William and Kate Middleton¿s wedding"
65,"Paul Burrell, pictured here with Diana in 1997, served the Princess of Wales as her butler for 10 years"
66,"Meghan Markle's former BFF Jessica Mulroney, and mother of royal bridesmaid Ivy, could be the key to revealing the truth about the Duchess' explosive dress row with Kate Middleton"
67,Prince Harry introduced Prince William to Meghan in late 2016. Pictured: The Prince and Princess of Wales and Duke and Duchess of Sussex in December 2017
68,"British stylist Miranda Holder reveals what items can make you look cheap. She said that headbands might look good on the Princess of Wales, who wears some for engagements, including Anzac Day celebrations last April, pictured, but that it can make us mere mortals look 'mumsy'"
69,"In his explosive new memoir, Harry claimed his wife Meghan was left 'on the floor sobbing' by a row with sister-in-law Kate Middleton over Princess Charlotte's bridesmaid's dresses"
70,"In 1992, Diana, Princess of Wales was pictured sitting alone at the famous landmark on a tour of India, in an image considered symbolic of the state of her relationship with Charles"
71,Prince Harry has claimed the Princess of Wales was among the members of his family who 'stereotyped' his wife Meghan. The royal wives are pictured in June 2018
72,Prince Harry told Tom Bradby that he felt 'slightly awkward' being a 'third wheel' to Prince William and Kate Middleton before meeting Meghan. The trio pictured in 2012
73,Royal expert said the Prince and Princess of Wales have been left feeling 'angry and betrayed' by Prince Harry's new book
74,Prince Harry told Tom Bradby that he felt 'slightly awkward' being a 'third wheel' to Prince William and Kate Middleton before meeting Meghan. The trio pictured in 2012
75,The Princess of Wales and Duchess of Sussex at the Wimbledon women's singles final together in 2019
76,"The two-bedroom Nottingham Cottage, which was both Harry and Meghan's and the Prince and Princess of Wales's first marital home, was described as 'so small' by Meghan in her recent Netflix series"
77,The Princess of Wales pictured for the first time in public today since Prince Harry's bombshell memoir Spare went on sale
78,Royal expert said the Prince and Princess of Wales have been left feeling 'angry and betrayed' by Prince Harry's new book
79,Harry reveals tension was brewing between Kate Middleton and Meghan Markle from the beginning (pictured at Trooping the Color in 2018) as Meghan's joke left a 'yawning silence'
80,Prince Harry told Tom Bradby that the Princess of Wales was among members of the Royal Family who 'stereotyped' his wife Meghan Markle when they first started dating
81,The Princess of Wales and Duchess of Cambridge pictured attending the Wimbledon women's singles final together in 2019
82,Prince Harry has claimed the Princess of Wales was among the members of his family who 'stereotyped' his wife Meghan. The royal wives are pictured in June 2018
83,The Princess of Wales and Duchess of Sussex at the Wimbledon women's singles final together in 2019
84,Prince Harry told Tom Bradby that he felt 'slightly awkward' being a 'third wheel' to Prince William and Kate Middleton before meeting Meghan. The trio pictured in 2012
85,"The two-bedroom Nottingham Cottage, which was both Harry and Meghan's and the Prince and Princess of Wales's first marital home, was described as 'so small' by Meghan in her recent Netflix series"
86,Prince William ignored a reporter who asked if he had a chance to read Harry's book. The question was posed today during the Prince and Princess of Wales' first royal engagement since the release of the searing memoir
87,The Prince and Princess of Wales were in Merseyside today visiting the Open Door Charity when Sky News reporter Inzamam Rashid queried: 'Have you had a chance to read your brother's book?' William and Kate are pictured during today's visit the charity
88,The Prince and Princess of Wales receive a rapturous welcome as they visit the Royal Liverpool Hospital
89,A crowd of royal fans greet the Prince and Princess of Wales in Liverpool
90,The Prince and Princess of Wales wave to crowds on their first engagement since Harry's book hit the shelves
91,The Princess of Wales smiling and waving as she arrives in Liverpool
92,Hospital staff try and Get a glimpse of HRH Prince and Princess of Wales during a visit to the new Royal Liverpool Hospital
93,The Princess of Wales chats to medics and visited Open Door Charity - who use arts and dance to help with well-being
94,"The Prince and Princess of Wales visited the new Royal Liverpool University Hospital, where Kate told several teenagers that talking therapies 'don't work for everyone'"
95,The Prince and Princess of Wales speaking to staff at the hospital
96,The Princess of Wales today in Liverpool
97,The official Prince and Princess of Wales Twitter account tweeted: 'Hi Merseyside'
98,The Princess of Wales was seen chatting happily as they went out this morning
99,A hospital worker was overwhelmed with emotion after meeting the Prince and Princess of Wales at the Royal Liverpool University Hospital this afternoon and told her friends she was 'going to cry' after speaking to Kate and calling her 'beautiful'
100,"Despite the explosive claims made about the Prince and Princess of Wales in Prince Harry's memoir, Spare, including that they 'stereotyped' his wife Meghan, royal fans queued in their droves to meet the couple and take selfies"
101,The Prince and Princess of Wales arrive to officially open the new Royal Liverpool University Hospital in Liverpool
102,The Princess of Wales pictured during her visit to the GSK Human Performance Lab in Brentford on 12 November 2014
103,King Charles' press officer allegedly told Kate's team that she should not be pictured with a tennis racquet during her engagement as it would 'wipe Charles off the front page'. The Princess of Wales pictured playing tennis in September 2021
104,Prince Harry has claimed the Princess of Wales was among the members of his family who 'stereotyped' his wife Meghan. The royal wives are pictured in June 2018
105,Prince Harry told Tom Bradby that he felt 'slightly awkward' being a 'third wheel' to Prince William and Kate Middleton before meeting Meghan. The trio pictured in 2012
106,Prince Harry's former fling says she 'would have loved' Harry to have married 'somebody like Kate Middleton'. Pictured: The Princess of Wales and Duchess of Sussex at Wimbledon in 2019
107,The Prince and Princess of Wales arrive to officially open the new Royal Liverpool University Hospital in Liverpool
108,"The Princess of Wales wore minimal make-up for the occasion, and was perfectly happy  smiling to the waiting fans"
109,"Queen Rania of Jordan, 52, praised the Princess of Wales' passion for royal duty in an interview with CNN which was recorded in London in September 2022, ahead of the late Queen Elizabeth's funeral"
110,"The Jordanian Queen said Kate Middleton, pictured on Christmas Day in Sandringham, 'gives from the heart'"
111,Harry reveals tension was brewing between Kate Middleton and Meghan Markle from the beginning (pictured at Trooping the Color in 2018) as Meghan's joke left a 'yawning silence'
112,The Princess of Wales and the Duchess of Sussex pictured attending the Wimbledon women's singles final together in 2019
113,"Sarah Kingham, 44, from Chelmsford, Essex, has a Kate Middleton inspired wardrobe bursting with designer outfits worth thousands and she revealed her collection is all from charity shops"
114,The Prince and Princess of Wales receive a rapturous welcome as they visit the Royal Liverpool Hospital
115,A crowd of royal fans greet the Prince and Princess of Wales in Liverpool
116,The Prince and Princess of Wales wave to crowds on their first engagement since Harry's book hit the shelves
117,The Princess of Wales smiling and waving as she arrives in Liverpool
118,Hospital staff try and Get a glimpse of HRH Prince and Princess of Wales during a visit to the new Royal Liverpool Hospital
119,"The Princess of Wales chats to medics during today's visit, as members of the public look on"
120,The Prince and Princess of Wales visiting the new Royal Liverpool University Hospital
121,The Prince and Princess of Wales speaking to staff at the hospital
122,The Princess of Wales today in Liverpool
123,The Princess of Wales during a visit to Royal Liverpool University Hospital
124,The official Prince and Princess of Wales Twitter account tweeted: 'Hi Merseyside'
125,The Princess of Wales was seen chatting happily as they went out this morning
126,"It also includes claims the Prince of Wales physically attacked Harry and teased him about his panic attacks, and that the King put his own interests above Harry's and was jealous of the Duchess of Sussex and the Princess of Wales. (Pictured: Harry and William at Buckingham Palace on July 10, 2018)"
127,"Prince William and Prince Harry with the King (then Prince Charles) holding a funeral programme at Westminster Abbey for the funeral of Diana, Princess of Wales, September, 1997"
128,"Gary Goldsmith is the Princess of Wales' uncle, and brother to Carole Middleton"
129,"'But if there¿s a manual on ¿How Not To Behave When Joining The Royal Family¿, Meghan has been following it word for word!' Pictured: The Princess of Wales, the Prince of Wales and the Duke and Duchess of Sussex meet the public at Windsor Castle, Berkshire following the death of Queen Elizabeth II, September 10, 2022"
130,"'Entitlement, crassness and casual insensitivity hallmarked her encounters with Kate and William.' Pictured: Catherine, The Princess of Wales, Meghan, The Duchess of Sussex, Countess of Wessex at Windsor Castle, October 12, 2018"
131,"After withstanding three weeks of Harry napalming the Royal Family with his ‘truth bombs’, the Princess of Wales — whether unwittingly or not — dropped a little bomb of her own this week"
132,Prince Harry introduced Prince William to Meghan in late 2016. Pictured: The Prince and Princess of Wales and Duke and Duchess of Sussex in December 2017
133,The Prince and Princess of Wales visiting the Royal Liverpool University Hospital in Liverpool
134,Prince Harry also claims the King and Queen Consort suggested the Princess of Wales change her name to Katherine to avoid there being another name starting with 'C' in the family
135,The Prince and Princess of Wales visiting the Royal Liverpool University Hospital
136,The Prince and Princess of Wales showed their natural rapport with members of the public as they stopped for selfies during a visit to Liverpool yesterday
137,Healthcare assistant Anna O'Hara asked the Prince (pictured right) and Princess of Wales for selfies on the critical care ward at the Royal Liverpool University Hospital
138,The Prince and Princess of Wales arrive to officially open the new Royal Liverpool University Hospital in Liverpool
139,"The Prince and Princess of Wales visited the new Royal Liverpool University Hospital, where Kate told several teenagers that talking therapies 'don't work for everyone'"
140,The Princess of Wales chats to medics and visited Open Door Charity - who use arts and dance to help with well-being
141,"Julia Samuel was one of Princess Diana¿s closest friends, a loyal confidante offering support and advice during her darkest days. Pictured: Diana, Princess of Wales, with Mrs Julia Samuel in the royal box at Wimbledon's Centre Court, 1994"
142,Erdem Moralioglu is a favoured designer of both the Princess of Wales and the Duchess of Sussex
143,"Diana, Princess of Wales (centre) attends The Savoy¿s Centenary Ball in 1989"
144,"Princess Charlene of Monaco (far left) was garbed in £655,574 worth of clothing over the last year making her the royal with the most expensive wardrobe. Next in line is Princess Maria-Olympia of Greece and Denmark (middle left), who spent about a third of Princess Charlene with £201,761. Kate, Princess of Wales (middle right), took third place, with a spending of £192,636 on her wardrobe last year. Her sister-in-law Meghan, Duchess of Sussex (far right), spent just £94,796 on new clothes last year"
145,"Kate, Princess of Wales, took third place, with a spending of £192,636 on her wardrobe last year. During last year's visit in Boston, Kate dazzled in Asprey London emerald and diamond earrings worth £9425, a Solace London dress worth £350 (which she rented for £74), Gianvito Rossi pumps worth £2,070 as well as Queen Mary's Art Deco Emerald & Diamond Choker (borrowed, no estimate). The value of her outfit that evening comes to £11,845 at a minimum"
146,The Princess of Wales saw her wardrobe total soar during 2022 as she returned to regular royal engagements and foreign tours following the end of the Covid-19 pandemic
147,"The Princess of Wales (pictured visiting the Royal Liverpool University Hospital this week) is said to have 'already moved on' following claims in Prince Harry's memoir which 'baffled' her, according to reports"
148,"Prince Harry claims in his memoir that the Princess of Wales and the Duchess of Sussex exchanged tense text messages before Harry and Meghan's wedding (pictured: The sisters-in-law at Trooping the Colour, 2018)"
149,Prince Harry claims in his bombshell memoir Spare that the Prince and Princess of Wales 'stereotyped' Meghan as a 'biracial American actress' (pictured: Cover of Spare)
150,"Tominey was one of the first journalists to report on the dispute between Meghan Markle (right) and her sister-in-law Kate Middleton over Princess Charlotte's bridesmaid dress, which supposedly left Kate in tears. However, the Sussexes later claimed in their March 2021 interview with Oprah Winfrey that it was Meghan who broke down in tears"
151,"William and Kate, the Prince and Princess of Wales, pictured here at Royal Liverpool University Hospital in Merseyside on Thursday, are set to attend the funeral"
152,"In his explosive memoir, Harry claims his wife Meghan Markle was left 'on the floor sobbing' by a row with her sister-in-law Kate Middleton over Princess Charlotte's bridesmaid's dresses"
153,Clothing created by fashion designer Erdem Moralioglu (pictured in London in December 2022) is said to have created some tension between Kate Middleton and Meghan Markle
154,"Paul Burrell, pictured here with Diana in 1997, served the Princess of Wales as her butler for 10 years"
155,The Prince and Princess of Wales arrived at Kate's Christmas carol service at Westminster Abbey in matching burgundy outfits following the Duke and Duchess of Sussex's second instalment of their Netflix series
156,The Prince and Princess of Wales attended the Royal Liverpool University Hospital last week in another set of matching outfits
157,Sources told the Mirror that the Princess of Wales (pictured in Merseyside) had 'already moved on' from Prince Harry's memoir claims
