,0
1387,Smartphones at the ready! Members of the public lined the Long Walk as the Prince and Princess of Wales made their surprise appearance
1388,The Prince and Princess of Wales head out of Windsor Castle ahead of the concert tonight
1389,The Princess of Wales cuddles the child celebrating the Coronation
1390,"The Prince of Wales, holding a can of Organic Coronation Ale, and the Princess of Wales during a walkabout meeting members of the public"
1391,The Princess of Wales comforted an upset little girl named Lucy during a walkabout at The Big Lunch in Windsor
1392,The Prince and Princess of Wales headed out of Windsor Castle to meet royal fans ahead of the concert tonight
1393,Prince William also spoke to a little girl who was full of exctiment this aftenoon and scored a hug from the Princess of Wales
1394,Knitted figurines of the Prince and Princess of Wales and their children on a postbox in Windsor. Several senior royals will make appearances at coronation lunches today
1395,The Princess of Wales showcased her natural charm with the public today as she posed for selfies with delighted royal fans during her Windsor walkabout
1396,The Princess of Wales cuddles a child celebrating the Coronation
1397,"The Princess of Wales visits the Coronation Big Lunch in Windsor on Sunday, where she high-fived the crowds"
1398,"Kate Middleton, 41, was the epitome of charm during multiple walkabouts with the public which saw her hugging children and posing for selfies"
1399,Royal expert Richard Fitzwilliams branded the bank holiday weekend a 'triumph' for the Princess of Wales (pictured with William during walkabout on Sunday)
1400,"Oliver (left) is George's Norfolk neighbour, as he lives at Houghton Hall in Norfolk, which is just four miles from Anmer Hall - the Prince and Princess of Wales's country retreat."
1401,"The Princess of Wales wore long white dresses no doubt inspired by the traditional court dresses traditionally worn by Windsor Wives at previous Coronations, topped with a patriotic blue and red robe"
1402,The Prince and Princess of Wales head out of Windsor Castle ahead of the concert tonight
1403,The Princess of Wales cuddles the child celebrating the Coronation
1404,"The Prince of Wales, holding a can of Organic Coronation Ale, and the Princess of Wales during a walkabout meeting members of the public"
1405,The Princess of Wales comforted an upset little girl named Lucy during a walkabout at The Big Lunch in Windsor
1406,The Prince and Princess of Wales both shook hands with fans along the Long Walk in Windsor
1407,The Prince and Princess of Wales with Princess Charlotte and Prince Louis arriving at Westminster Abbey on Saturday
1408,Knitted figurines of the Prince and Princess of Wales and their children on a postbox in Windsor. Several senior royals will make appearances at coronation lunches today
1409,The Princess of Wales cuddles the child celebrating the Coronation
1410,"Catherine, Princess of Wales comforts another overwhelmed girl, Lucy, during a walkabout"
1411,The Princess of Wales poses for a selfie with a Windsor concertgoer. Security removed her hand as it grabbed Kate's hair
1412,The Princess of Wales really enjoyed high-fiving a child
1413,"Catherine, Princess of Wales, takes a walkabout at The Big Lunch in Windsor"
1414,The Prince and Princess of Wales head out of Windsor Castle ahead of the concert tonight
1415,The Prince and Princess of Wales both shook hands with fans along the Long Walk in Windsor
1416,The Prince and Princess of Wales with Princess Charlotte and Prince Louis arriving at Westminster Abbey on Saturday
1417,Knitted figurines of the Prince and Princess of Wales and their children on a postbox in Windsor. Several senior royals will make appearances at coronation lunches today
1418,Kate's effortless style steals the show: The Princess of Wales wore a cornflower blue blazer as she surprised royal fans at a Big Lunch gathering in Windsor
1419,The Princess of Wales poses for photograph with a royal fan as she attends Windsor Big Lunch
1420,Princess of Wales grins at her husband as they attend a Big Lunch event in Windsor
1421,The Princess of Wales speaks to royal fans as she attended the Windsor Big Lunch today
1422,Crowds gather in Windsor as Kate Middleton and Prince William step out for Big Lunch
1423,The Princess of Wales stunned in an ivory silk crepe gown by Alexander McQueen for the Coronation yesterday
1424,The Prince and Princess of Wales head out of Windsor Castle ahead of the concert tonight
1425,The Princess of Wales cuddles the child celebrating the Coronation
1426,"The Prince of Wales, holding a can of Organic Coronation Ale, and the Princess of Wales during a walkabout meeting members of the public"
1427,The Princess of Wales comforted an upset little girl named Lucy during a walkabout at The Big Lunch in Windsor
1428,The Prince and Princess of Wales both shook hands with fans along the Long Walk in Windsor
1429,The Prince and Princess of Wales with Princess Charlotte and Prince Louis arriving at Westminster Abbey on Saturday
1430,Knitted figurines of the Prince and Princess of Wales and their children on a postbox in Windsor. Several senior royals will make appearances at coronation lunches today
1431,Knitted figurines of the Prince and Princess of Wales and their children on a postbox in Windsor. Several senior royals will make appearances at coronation lunches today
1432,The Princess of Wales appeared 'relaxed in her moves' as she approached the crowds with Prince William at the Mall on Friday
1433,"The Prince and Princess of Wales are seen on the Buckingham Palace balcony with their cihldren Prince George, Princess Charlotte and Prince Louis, along with the Duchess of Edinburgh, her daughter Lady Louise, Princess Anne and her husband Vice Admiral Sir Timothy Laurence"
1434,"Prince George with Prince Louis, Princess Charlotte and the Prince and Princess of Wales on the Buckingham Palace balcony for the late Queen's Platinum Jubilee last June"
1435,Keeping you up? The Prince and the Princess of Wales's youngest son Louis - who turned five on St George's Day on April 23rd - melted hearts again at Westminster Abbey on May 6
1436,"Prince Louis also showered his mother, Kate Middleton, with kisses and cuddles during the Queen's Platinum Jubilee Pageant in June last year"
1437,The Princess of Wales and Louis arriving for the traditional Easter Sunday Mattins Service at St. George's Chapel
1438,2014 - Prince Harry with Kate Middleton and Archbishop of Canterbury Justin Welby at a ceremony in Belgium commemorating the 100th anniversary of the start of the First World War
1439,The Princess of Wales's stunning floral coronation headpiece may have been a sweet tribute to the late Queen Elizabeth II as it harked back to her 1947 wedding day
1440,"(L-R) Lady Louise Mountbatten-Windsor, Sir Timothy Laurence, Sophie, the Duchess of Edinburgh, Princess Charlotte of Wales, Princess Anne, Princess Royal, Catherine, Princess of Wales, Prince Louis of Wales and Prince William, Duke of Cambridge during the Coronation of King Charles"
1441,The dazzling headpiece was a break from tradition for the Princess of Wales who chose not to wear a tiara for the occasion
1442,Knitted figurines of the Prince and Princess of Wales and their children on a postbox in Windsor. Several senior royals will make appearances at coronation lunches today
1443,"Framed perfectly by the window of her carriage, the Princess of Wales returns from the Abbey"
1444,"As the Coronation procession made its way up the aisle of Westminster Abbey yesterday, the female under the most pressure fashion-wise was the Princess of Wales"
1445,"The Alexander McQueen dress Kate wore yesterday – beneath her red, white and deep blue Royal Victorian Order Mantle – delivered the Princess of Wales all the protection she needed"
1446,"King Charles III and Queen Camilla are pictured with members of the working royal family: (left to right) the Duke of Kent, the Duchess of Gloucester, the Duke of Gloucester, Vice Admiral Sir Tim Laurence, the Princess Royal, King Charles III, Queen Camilla, the Prince of Wales, the Princess of Wales, the Duchess of Edinburgh, Princess Alexandra, the Hon. Lady Ogilvy, the Duke of Edinburgh"
1447,The Princess of Wales and her daughter Princess Charlotte looked incredible in matching Alexander McQueen coronation dresses at Westminster Abbey
1448,The Prince and Princess of Wales have released new behind-the-scenes footage of their young children mucking in to help renovate a Scout hut as they led the nation in a day of volunteering for the Big Help Out event
1449,"For the official Coronation photographs, the Princess of Wales paid tribute to Queen Elizabeth by wearing one of the late monarch's necklaces. Pictured: The Princess of Wales wearing Queen Elizabeth's George VI Festoon Necklace"
1450,"King Charles III and Queen Camilla are pictured with members of the working royal family: (left to right) the Duke of Kent, the Duchess of Gloucester, the Duke of Gloucester, Vice Admiral Sir Tim Laurence, the Princess Royal, King Charles III, Queen Camilla, the Prince of Wales, the Princess of Wales, the Duchess of Edinburgh, Princess Alexandra, the Hon. Lady Ogilvy, the Duke of Edinburgh"
1451,"On Saturday, the Princess of Wales wore a gown which featured a high neckline for the Coronation service"
1452,"Following on from the Coronation Concert last night, the Prince and Princess of Wales, with their three children in tow,"
1453,"Prince Louis, the Princess of Wales and Princess Charlotte hold hands during the event this afternoon"
1454,"Left to right: The Duke of Kent, the Duchess of Gloucester, the Duke of Gloucester, Vice Admiral Sir Tim Laurence, the Princess Royal, King Charles III, Queen Camilla, the Prince of Wales, the Princess of Wales, the Duchess of Edinburgh, Princess Alexandra, the Hon. Lady Ogilvy, the Duke of Edinburgh"
1455,"The Prince of Wales, holding a can of Organic Coronation Ale, and the Princess of Wales during a walkabout meeting members of the public in Windsor on Sunday"
1456,"The Prince and Princess of Wales seen during a surprise walkabout in Windsor on Sunday, ahead of the star-studded Coronation concert"
1457,"Left to right: The Duke of Kent, the Duchess of Gloucester, the Duke of Gloucester, Vice Admiral Sir Tim Laurence, the Princess Royal, King Charles III, Queen Camilla, the Prince of Wales, the Princess of Wales, the Duchess of Edinburgh, Princess Alexandra, the Hon. Lady Ogilvy, the Duke of Edinburgh"
1458,"Prince William, Prince of Wales and Catherine, Princess of Wales leave the Abbey with their children"
1459,Prince Louis waves as the Prince and Princess of Wales leave with George and Charlotte
1460,"Prince Louis waves as the Prince and Princess of Wales leave with George and Charlotte, who was also waving"
1461,"As the family rolled their sleeves up to renovate a building in Slough, fan-favourite Louis was full of energy as he bounced about while the Prince and Princess of Wales later toasted marshmallows"
1462,The Princess of Wales has been Joint President of the Scouts since 2020 and the royals joined volunteers in resetting a path among other tasks
1463,"Prince Louis takes control of a wheelbarrow as he helps his mother, Britain's Catherine, Princess of Wales take part in the Big Help Out in Slough"
1464,"Kate Middleton dressed her daughter in a designer knit, £15 polo top, denim shorts and some £20 trainers"
1465,"Last year, the Princess of Wales dressed her daughter in an almost identical outfit for her seventh birthday portrait"
1466,The Princess of Wales has revealed an affectionate nickname for her youngest son as she and her husband got their children to roll their sleeves up for The Big Help Out today
1467,"As the family rolled their sleeves up to renovate a building in Slough, fan-favourite Louis was full of energy as he bounced about while the Prince and Princess of Wales later toasted marshmallows"
1468,The Princess of Wales has been Joint President of the Scouts since 2020 and the royals joined volunteers in resetting a path among other tasks
1469,"Prince Louis takes control of a wheelbarrow as he helps his mother, Britain's Catherine, Princess of Wales take part in the Big Help Out in Slough"
1470,"Prince Louis takes control of a wheelbarrow as he helps his mother, Britain's Catherine, Princess of Wales take part in the Big Help Out in Slough"
1471,The Big Help Out is known to be a passion project for the Princess of Wales
1472,Keeping you up? The Prince and the Princess of Wales's youngest son Louis - who turned five on St George's Day on April 23rd - melted hearts again at Westminster Abbey on May 6
1473,The Prince and Princess of Wales' daughter put all her strength into the task and frowned as she released the bow
1474,The Princess of Wales had the slight advantage of having taken an archery lesson during a 2016 royal visit to Bhutan
1475,"Prince Louis takes control of a wheelbarrow as he helps his mother, Britain's Catherine, Princess of Wales take part in the Big Help Out in Slough"
1476,The Prince and Princess of Wales' youngest child was seen filling a wheelbarrow with sand. Social media fans commented on how it looks like 'something he has done before'
1477,"Prince Louis takes control of a wheelbarrow as he helps his mother, Britain's Catherine, Princess of Wales take part in the Big Help Out in Slough"
1478,"Prince Louis takes control of a wheelbarrow as he helps his mother, Britain's Catherine, Princess of Wales take part in the Big Help Out in Slough"
1479,The Big Help Out is known to be a passion project for the Princess of Wales
1480,"Catherine, Princess of Wales, Britain's Prince Louis of Wales and Britain's Princess Charlotte of Wales help to reset a path"
1481,"Donna and Ciara Robinson, who met The Princess of Wales"
1482,The Prince and Princess of Wales are expected to spend the Coronation bank holiday volunteering with some of the UK's largest charities. The pair pictured during a walkabout on Sunday
1483,"Charlotte, eight, seems to be taking after her stylish mother, The Princess of Wales, as she donned a new stylish gown for the special occasion at Windsor Castle"
1484,"Family affair! The Princess of Wales, Princess Eugenie, Princess Charlotte and Prince George all got on their feet during the Coronation Concert"
1485,The Princess of Wales and her daughter Princess Charlotte pictured curtseying to King Charles as he walked past them in the royal box
1486,"The young royal, 8, looked to be struggling with the paper around her arm as she waved her Union Jack about in the stands, looking lost before she sought out the Princess of Wales"
1487,"Kate Middleton, 41, was the epitome of charm during multiple walkabouts with the public which saw her hugging children and posing for selfies"
1488,"The Princess of Wales exceeded expectations over the Coronation weekend and showed herself to be the new Queen in waiting, royal experts have said (Pictured: Princess Catherine on walkabout last Friday)"
1489,"The Princess of Wales, 41, looked radiant in a dazzling ivory Alexander McQueen dress as she attended the King¿s Coronation alongside Prince William today"
1490,"The Princess of Wales, 41, looked radiant in a dazzling ivory Alexander McQueen dress as she attended the King¿s Coronation alongside Prince William on Saturday (pictured)"
1491,"The Princess of Wales visits the Coronation Big Lunch in Windsor on Sunday, where she high-fived the crowds"
1492,"The Prince of Wales, holding a can of Organic Coronation Ale, and the Princess of Wales during a walkabout meeting members of the public"
1493,Royal expert Richard Fitzwilliams branded the bank holiday weekend a 'triumph' for the Princess of Wales (pictured with William during walkabout on Sunday)
1494,The Princess of Wales smiled as an excited royal fan took a selfie during Sunday's Windsor walkabout
1495,"The Princess of Wales waved to royal fans as the concert started on Sunday evening, while Princess Charlotte kept her eyes on the stage"
1496,"Catherine, Princess of Wales, Princess Charlotte of Wales, Prince George of Wales and Prince William, Prince of Wales"
1497,"Both Princess Charlotte, 8, and her mother Kate Middleton, 41, appeared to have the fun of a lifetime at King Charles's star-studded Coronation concert"
1498,"Princess Charlotte sung along to Katy Perry at the Coronation concert with her mother, Kate Middleton"
1499,"Family affair! The Princess of Wales, Princess Eugenie, Princess Charlotte and Prince George all got on their feet during the Coronation Concert"
1500,The Prince and Princess of Wales are expected to spend the Coronation bank holiday volunteering with some of the UK's largest charities. The pair pictured during a walkabout on Sunday
1501,"Lisa Wilkinson's (pictured) notorious gaffe from her coverage of the wedding of Prince William and Kate Middleton in April 2011 has resurfaced, after she was noticeably absent from Channel Ten's reporting of King Charles III's coronation on Saturday"
1502,The Prince and Princess of Wales heading to the concert
1503,The Prince and Princess of Wales with their children ahead of taking their seats at the concert
1504,"The Princess of Wales, Princess Eugenie, Princess Charlotte and Prince George - with Keir Starmer seen behind"
1505,Radiant Kate Middleton and smartly dressed Prince William take to their seats as they arrive for the concert
1506,"The Princess of Wales in the royal box - she appears to be having a great time, clapping along to the music"
1507,"Princess of Wales, Princess Charlotte, Prince George, and Prince William, Prince of Wales, in the Royal Box at the Coronation Concert"
1508,"The Princess of Wales was full of smiles at the concert - which had 20,000 guests and many more members of the public watching"
1509,Prince George and Princess Charlotte appeared in high spirits as they joined their parents The Prince and Princess of Wales at the star-studded Coronation concert this evening
1510,"As the Princess of Wales danced, Princess Charlotte said something in her brother's ears as they both waved their flags during the concert"
1511,"The Princess looked at the crowd as she waved her flag to the music of the concert, while Kate Middleton said something to her and Prince George"
1512,"The Princess of Wales shared a joke with Aldith Grandison, 93, who laughed that Kate was the 'strict one'"
1513,The Princess of Wales led the glamour as she hosted a Buckingham Palace garden party with her husband and the Duke and Duchess of Edinburgh on Tuesday
1514,"Princess of Wales at Royal Ascot, 2019"
1515,"The Princess of Wales greets Aldith Grandison, 93, and her daughter Jay Cee La Bouche during the party"
1516,The Princess of Wales beamed and laughed as she appeared to spot a familiar face in the crowd of guests
1517,"Prince Louis takes control of a wheelbarrow as he helps his mother, Britain's Catherine, Princess of Wales take part in the Big Help Out in Slough"
1518,The Prince and Princess of Wales were joined by the Duke and Duchess of Edinburgh to host the Coronation special Buckingham Palace Garden Party - and Kate and Sophie matched their outfits
1519,"Princess of Wales at Royal Ascot, 2019"
1520,The Prince and Princess of Wales shared on Instagram that they were 'celebrating people who do extraordinary things' at the garden party
1521,The Princess of Wales beams as she strolls across the Buckingham Palace garden
1522,The Princess of Wales beams as she attends the garden party and meets with Coronation Champions
1523,"The Princess of Wales greets Aldith Grandison, 93, and her daughter Jay Cee La Bouche during the party"
1524,The Princess of Wales glowed in the sunshine as she strolled around the Buckingham Palace garden
1525,The Princess of Wales beamed and laughed as she appeared to spot a familiar face in the crowd of guests
1526,The Duchess of Edinburgh's look almost completely matched the Princess of Wales - even down to the floral headpiece within the hat
1527,The Princess of Wales chatted to volunteers from the Scouts community as she greeted the guests
1528,The Princess of Wales looked regal in powder blue as she attended the special Coronation garden party at Buckingham Palace with Prince William
1529,"Left to right: The Duke of Kent, the Duchess of Gloucester, the Duke of Gloucester, Vice Admiral Sir Tim Laurence, the Princess Royal, King Charles III, Queen Camilla, the Prince of Wales, the Princess of Wales, the Duchess of Edinburgh, Princess Alexandra, the Hon. Lady Ogilvy, the Duke of Edinburgh"
1530,Lady Margarita (centre) served as a bridesmaid for the Prince and Princess of Wales when she was eight years old
1531,The Princess of Wales wearing Queen Elizabeth's George VI Festoon Necklace and her Alexander McQueen ivory dress with silver embroidery
1532,The Princess of Wales also owns the designer full-length gown in black. Pictured: Wearing the dress at a Buckingham Palace reception in December 2019
1533,The Princess of Wales in her white Jenny Packham dress
1534,"In 2011, Lady Louise was a bridesmaid at the wedding of Prince William and Kate Middleton"
1535,Prince William and Kate Middleton pictured attending the 1st Battalion Irish Guards' St. Patrick's Day Parade at Mons Barracks when they were known as the Duke and Duchess of Cambridge
1536,The Prince and Princess of Wales arrived at Westminster Abbey with their children after the King and Queen on Saturday
1537,"The Princess of Wales, 41, teamed up with Duchess of Edinburgh, 58, along with their husbands, to host the Buckingham Palace garden party yesterday"
1538,"Icon: The Princess of Wales in Karen Millen. It was the Princess¿s patronage, alongside other high-profile fans including Jill Biden, Liz Truss and Liz Hurley, that for Millen signified the revival of the label"
1539,"It may have been one of the biggest weeks of her life - but Kate Middleton, 41,  proved her style is as down to earth as ever during the Coronation celebrations"
1540,"Rather than splashing out on expensive jewellery and multiple new designer outfits, the Princess of Wales opted to recycle a number of pieces she already had in her wardrobe for the high profile event this week"
1541,"The Princess of Wales travels on London Underground's Elizabeth Line in central London, on their way to visit the Dog & Duck pub in Soho to hear how it's preparing for the coronation of King Charles III and the Queen"
1542,"The Princess of Wales on a walkabout outside Buckingham Palace, London, to meet wellwishers ahead of the coronation"
1543,Princess of Wales in the Royal Box at the Coronation Concert in the grounds of Windsor Castle
1544,Princess of Wales attends King Charles III's Coronation Garden Party at Buckingham Palace on May 9
1545,Beth Mead appeared in  a video posted on the Prince and Princess of Wales's Twitter account after receiving her MBE today
1546,The Princess of Wales is now a crucial part of the monarchy. Here she is pictured in the robes of the The Royal Victorian Order on the balcony of Buckingham Palace following the Coronation
1547,"Kate Mansey, Assistant Editor of The Mail on Sunday, believes that the Princess of Wales has stepped up a gear in her public appearances - and that there is more to come"
1548,"As the new Princess of Wales, Kate is more confident than ever is and fast becoming The Royal Family's not-so-secret weapon. She is much more 'herself' than in the past"
1549,The Princess of Wales during walkabout along the Mall to meet royal well wishers ahead of King Charles III's Coronation
1550,Kate's effortless style steals the show: The Princess of Wales wore a cornflower blue blazer as she surprised royal fans at a Big Lunch gathering in Windsor
1551,Prince William and Kate Middleton on an Elizabeth line train at Acton Main Line last Thursday
1552,"The Prince and Princess of Wales have shown diligence and good humour, but they cannot be expected to carry the entire burden by themselves. They are pictured here at a post-Coronation garden party at Buckingham Palace"
1553,"The Princess of Wales, 41, teamed up with Duchess of Edinburgh, 58, along with their husbands, to host the Buckingham Palace garden party yesterday"
1554,"'Too stressed? It will calm you. Down in the dumps? It will lift you up,' she said. 'It's a calming color that helps us grow, and I love wearing it.' Kate Middleton is seen wearing green in 2020"
1555,"Kate Middleton wore a blue coat with a navy sweater and belted flare-like trousers. She wore the garment at The Foundling Museum on January 19, 2022"
1556,"The Princess of Wales wore an orange knit roll-neck and matching skirt from Gabriela Hearst, which she paired with a brown belt and suede boots to Foxcubs Nursery in January 2023"
1557,"Whilst visiting Abergavenny Market, Kate Middleton wowed in a long wool Sportmax coat with matching olive green roll-neck in March 2022"
1558,A smiling Kate Middleton visiting Oxford House Nursing Home in Slough wearing a stylish Ralph Lauren roll neck sweater in navy teamed with her Max&Co coat in February 2023
1559,Kate Middleton teamed her Kiltane Cashmere roll-neck in Bordeaux with her Celeste Hobbs coat  when visiting Falmouth with Prince William on their first joint official visit to Cornwall since they became the Duke and Duchess of Cornwall in February 2023
1560,In December 2011 Kate Middleton visited Centrepoint's Camberwell Foyer wearing a Ralph Lauren olive green roll-neck wool dress
1561,Sir Tim is seen with Kate Middleton as they walk through the Commonwealth War Grave Commission's Tyne Cot Cemetery in Ypres in July 2017
1562,"The Princess of Wales, 41, teamed up with Duchess of Edinburgh, 58, along with their husbands, to host the Buckingham Palace garden party yesterday"
1563,The Princess of Wales' family released this photo of the royal couple taken on their graduation day to celebrate their 2011 wedding
