,0
1915,A high-five for a young royal fan! The Princess of Wales delighted a child who had queued to meet her in Nuneaton this morning as she paid a visit  to health workers
1916,"As she left the Riversley Park Children's Centre, the Princess of Wales carried a posy of flowers and waved goodbye to well-wishers"
1917,Included in the elegant bunch of flowers gifted to the Princess of Wales were white lilies and eucalyptus
1918,The Princess of Wales chatted with health workers at Riversley Park Children's Centre in Nuneaton
1919,"The Princess of Wales beamed as she chatted to the children, who were all wearing caps to shield themselves from the sunshine, this morning"
1920,The Princess of Wales looked elegant in a £490 Cefinn dress as she greeted schoolchildren at Riversley Park Children's Centre
1921,A high-five for a young royal fan! The Princess of Wales delighted a child who had queued to meet her in Nuneaton this morning as she paid a visit  to health workers
1922,"As she left the Riversley Park Children's Centre, the Princess of Wales carried a posy of flowers and waved goodbye to well-wishers"
1923,Included in the elegant bunch of flowers gifted to the Princess of Wales were white lilies and eucalyptus
1924,The Princess of Wales looked radiant in a £490 Cefinn silk shirt dress as she paid a visit to health workers in Nuneaton today
1925,The Princess of Wales chatted with health workers at Riversley Park Children's Centre in Nuneaton
1926,"The Princess of Wales beamed as she chatted to the children, who were all wearing caps to shield themselves from the sunshine, this morning"
1927,The Princess of Wales looked elegant in a £490 Cefinn dress as she greeted schoolchildren at Riversley Park Children's Centre
1928,"The Princess of Wales has commissioned a £50,000 NHS project which assesses babies' happiness and wellbeing, after she first saw the model in use during a trip to Denmark last year (pictured)"
1929,The Prince and Princess of Wales posted a subtle tribute to the 72 victims of the Grenfell Tower fire on Twitter
1930,The Princess of Wales kept her hand on her husband's leg when they attended a game between the Boston Celtics and the Miami Heat at TD Garden in Boston on their three-day tour last year
1931,"As the couple arrived at Royal Festival Hall in London, Kate Middleton, 41, and the Prince appeared to exchange a few words"
1932,The Caribbean tour was a real look into the Prince and Princess of Wales' ten-year marriage -Kate definitely appeared to be relaxed and happy to show her affection for her husband
1933,"Saffron Aldridge, 55, is a friend of both the Princess of Wales and the Duchess of Sussex"
1934,"The Prince and Princess of Wales, who are Colonel of the Welsh Guards and Colonel of the Irish Guards respectively, will also attend the dinner. Pictured on the day of King Charles' coronation with Princess Charlotte and Prince Louis"
1935,"The Princess of Wales (pictured left) has appeared in a slick new video for her Shaping Us campaign, in which she shadows health visitors to 'gain a deeper insight into their essential role'"
1936,Queen Camilla and the Princess of Wales (pictured) both sported elegant green dresses for their latest outings - and the colour is possibly a touching nod to the sixth anniversary of the Grenfell Tower fire
1937,The Prince and Princess of Wales posted a subtle tribute to the 72 victims of the Grenfell Tower fire on Twitter on Wednesday
1938,"The Princess of Wales was the picture of summer style in a chic £490 shirt dress from Cefinn, as she chatted with health workers in Nuneaton on Thursday"
1939,The Daily Mail's royal editor Rebecca English (pictured) discussed the Prince and Princess of Wales' approach to their duties in the latest installment of the Mail+'s Palace Confidential series
1940,The Princess of Wales and Camilla at the 2022 Trooping the Colour. Kate's hats have evolved over the years to become more striking
1941,Royal Fashion expert Eliza Scarborough looks at how the Princess of Wales' hat style at Trooping the Colour has evolved since her debut in 2011
1942,"The Prince and Princess of Wales, their children and the King and Queen smile and wave to wellwishers"
1943,"Left to right: The Duke of Kent, the Duchess of Gloucester, the Duke of Gloucester, Vice Admiral Sir Tim Laurence, the Princess Royal, King Charles III, Queen Camilla, the Prince of Wales, the Princess of Wales, the Duchess of Edinburgh, Princess Alexandra, the Hon. Lady Ogilvy, the Duke of Edinburgh"
1944,"Parents: Louis' parents appeared to be touching him as he posed while doing a salute (pictured L-R: Prince George, Prince Louis, the Princess of Wales)"
1945,"The lively five-year-old was accompanied by his older siblings Prince George and Princess Charlotte , as well as his mother the Princess of Wales, and Queen Camilla"
1946,Camilla and The Princess of Wales were pictured smiling and waving as they made their way to Horse Guards Parade
1947,"She travelled in a carriage alongside Kate, Princess of Wales and her children, Prince Louis, five, Princess Charlotte, eight, and Prince George, nine"
1948,"Prince George, Princess Charlotte and Prince Louis travelled to Horse Guards Parade with their mother the Princess of Wales and Queen Camilla for the Trooping the Colour"
1949,"Gorgeous in green: Kate, Princess of Wales, opted for a monochrome outfit in green for today's festivities"
1950,"The Princess of Wales (pictured, right) donned an all-green ensemble as she attended the Trooping the Colour celebrations today (pictured with Queen Camilla, left)"
1951,The Princess of Wales rode to the event in a carriage alongside her three children (pictured) and the Queen Consort (pictured)
1952,"Kate Middleton, 41, was snapped beaming as she waved at bystanders while making her way to the event"
1953,Princess of Wales watches on as the King's Birthday Parade takes place in London
1954,"Kate, Princess of Wales and Queen Camilla sit together in a carriage for Trooping the Colour"
1955,"Travelling in a carriage were the Queen, the Princess of Wales, along with Prince George, nine, Princess Charlotte, eight, and five-year-old Prince Louis"
1956,"Prince Louis, the Princess of Wales and Princess Charlotte ride in a carriage as they take part in the Royal Procession as it returns to Buckingham Palace after the Trooping the Colour ceremony"
1957,"Queen Camilla and Catherine, Princess of Wales, attend the Trooping the Colour parade"
1958,"Queen Camilla chose a red outfit while Catherine, Princess of Wales went for green"
1959,A pregnant Princess of Wales joins the royal family on the balcony of Buckingham Palace for the 1982 Trooping the Colour ceremony
1960,The Princess of Wales and the Duchess of York smiling on the balcony of Buckingham Palace
1961,"Queen Elizabeth The Queen Mother and Diana, Princess of Wales, travelling in a carriage"
1962,"Kate Middleton Princess Charlotte, Prince George, Prince William, Duke of Cambridge, Queen Elizabeth II and Prince Philip, stand on the balcony during the Trooping the Colour in 2016"
1963,"The Princess of Wales (pictured during Trooping the Colour on June 17) has hailed children's hospices for their 'life-changing care', saying they are a 'shining light' to families"
1964,"Diana, Princess of Wales during a visit to the homeless charity The Passage with her sons, (then) Prince Harry (2nd left) and Prince William (2nd right) in the early 1990s"
1965,"The Late Queen Elizabeth can be seen sitting with eight of her 12 great-grandchildren in a heart-warming photograp taken by the Princess of Wales at Balmoral last summer. Pictured left the right: back row: Lady Louise Windsor and James, Earl Wessex. Second row: Lena Tindall, Prince George, Princess Charlotte, Isla Phillips and Prince Louis. Front row: Mia Tindall holding Lucas Tindall. The late Queen Elizabeth II and Savannah Phillips"
1966,"Kate Middleton, 41, was effortlessly elegant in an emerald green, satin-look dress and matching hat - which she adorned with a borrowed golden brooch of a three-leaf clover"
1967,"Diana, Princess of Wales during a visit to the homeless charity The Passage with her sons, (then) Prince Harry (2nd left) and Prince William (2nd right) in the early 1990s"
1968,"The Prince and Princess of Wales depart the annual Order of the Garter Service at St George's Chapel, Windsor Castle"
1969,'The look of love!' Royal fans went wild today as the Princess of Wales beamed adoringly at her husband from outside St George's Chapel in Windsor
1970,"Catherine, Princess of Wales and Sophie, Duchess of Edinburgh react as they arrive at St George's Chapel"
1971,"Catherine, Princess of Wales waves as she arrives at St George's Chapel to attend the Most Noble Order of the Garter Ceremony in Windsor Castle"
1972,"Sophie (pictured right), 58, looked typically stylish in a pink and white midi dress from Emilia Wickstead, priced at £ 1,628, when attending the ceremony at St George's Chapel, alongside other Royal Family members, including the Princess of Wales"
1973,"Meanwhile, joining Sophie at the service, the Princess of Wales was the picture of elegance in a chic black-and-white polka dot midi dress by Alessandra Rich for the occasion"
1974,The Princess of Wales looked sensational in a white-and-black polka dot print dress for Garter Day this afternoon
1975,"The Prince and Princess of Wales, Sophie, Duchess of Edinburgh and Prince Edward, Duke of Edinburgh react after King Charles III and Queen Camilla left in a horse-drawn carriage from St George's Chapel after attending the Most Noble Order of the Garter ceremony"
1976,The Princess of Wales opted for a some smokey brown-towned eyeshadow and some nude lipstick
1977,"The Princess of Wales, 41, donned an Alessandra Rich gown for this afternoon's service in Windsor"
1978,Pictured: The Prince and Princess of Wales leave in a horse-drawn carriage from St George's Chapel after attending the Most Noble Order of the Garter Ceremony
1979,The Princess of Wales also wore a pair of pearl earrings which once belonged to her late mother-in-law Princess Diana
1980,The Princess of Wales opted for some smokey brown eyeshadow and a nude lip for this afternoon's engagement
1981,The Princess of Wales
1982,The Princess of Wales completed her ensemble with a cream leather clutch bag and a pearl bracelet
1983,Pictured: the Princess of Wales wave to crowds as she arrived at St George's Chapel in Windsor
1984,The Princess of Wales looked sensational in a white-and-black polka dot print dress for Garter Day this afternoon
1985,Pictured: the Princess of Wales finished off her ensemble with a pair of white heels with a black toe
1986,The Princess of Wales' choice of outfit highlighted her slander physique and was pure perfection from head to toe
1987,"Catherine, Princess of Wales and Sophie, Duchess of Edinburgh react as they arrive at St George's Chapel"
1988,"Catherine, Princess of Wales waves as she arrives at St George's Chapel to attend the Most Noble Order of the Garter Ceremony in Windsor Castle"
1989,Prince William and Catherine Princess of Wales at Garter Day this afternoon
1990,"The Prince of Wales, The Princess of Wales, the Duchess of Edinburgh and the Duke of Edinburgh"
1991,The Princess of Wales Duchess of Edinburgh hold their hats as they arrive at St George's Chapel to attend the Most Noble Order of the Garter Ceremony in Windsor Castle
1992,The Princess of Wales laughs as she arrives with the Duchess of Edinburgh at St George's Chapel
1993,The Princess of Wales beams in a polka dot dress as she arrives for today's historic service
1994,The Princess of Wales beams in a polka dot dress as she arrives for today's historic service
1995,The Princess of Wales and Duchess of Edinburgh were among the first to arrive at the event
1996,Opening: The Princess of Wales (left) opened the gallery alongside Paul McCartney (centre) and his wife Nancy (right)
1997,The Princess of Wales (pictured) once again stepped out in a pair of Meghan Markle's favourite heels to reopen the National Portrait Gallery today
1998,"The Princess of Wales erupted in laughter upon meeting Sir Paul McCartney at the National Portrait Gallery this morning, as he joked that his wife Nancy (right) might not have been around in the 1960s when he was in The Beatles"
1999,A work of art! The Princess of Wales looked radiant in a white Self Portrait dress with a pleated skirt and tweed jacket as she arrived at the National Portrait Gallery
2000,The Princess of Wales stands in front of Joshua Reynolds's portrait of Mai in the National Portrait Gallery
2001,The Princess of Wales also viewed the Yevonde: Life and Colour exhibition as part of her tour of the refurbished gallery
2002,"After laughing at the ex-Beatle's joke, the Princess of Wales shook his wife Nancy's hand"
2003,Emin led the Princess of Wales into the National Portrait Gallery through the doors she had designed
2004,"Standing outside the new doors, the Princess of Wales said farewell to the staff and royal fans outside the building"
2005,The Princess of Wales brushed her hair away from her face as she arrived at the National Portrait Gallery
2006,"The family tried to make the short trip to the Princess of Wales Hospital in Bridgend but Loren couldn't wait; she gave birth around a mile away from the maternity ward. Pictured, Loren's two daughters"
2007,Jill Scott looks to have taken a leaf out of the Princess of Wales' look book as she attended the Royal Ascot in a summery polka-dot gown that strongly resembles Kate Middleton's
2008,"The Princess of Wales erupted in laughter upon meeting Sir Paul McCartney at the National Portrait Gallery this morning, as he joked that his wife Nancy (right) might not have been around in the 1960s when he was in The Beatles"
2009,A work of art! The Princess of Wales looked radiant in a white Self Portrait dress with a pleated skirt and tweed jacket as she arrived at the National Portrait Gallery
2010,The Princess of Wales stands in front of Joshua Reynolds's portrait of Mai in the National Portrait Gallery
2011,The Princess of Wales also viewed the Yevonde: Life and Colour exhibition as part of her tour of the refurbished gallery
2012,"After laughing at the ex-Beatle's joke, the Princess of Wales shook his wife Nancy's hand"
2013,Emin led the Princess of Wales into the National Portrait Gallery through the doors she had designed
2014,"Standing outside the new doors, the Princess of Wales said farewell to the staff and royal fans outside the building"
2015,The Princess of Wales brushed her hair away from her face as she arrived at the National Portrait Gallery
2016,"Coordinated again, the newly created Prince and Princess of Wales visit Belfast last autumn"
2017,Blue is the colour: here the Prince and Princess of Wales prepare to host a post-Coronation garden party at Buckingham Palace
2018,"Inspired by Kate? This chic reveller looked stunning in a white frock with black polka dots, just days after the Princess of Wales opted for a similar dress"
2019,"As heir to the throne, William is well aware of the burden he carries. With the grief and tension clear upon their faces, the Prince and Princess of Wales watch Queen Elizabeth's Lying-in-State at Westminster Hall"
2020,The Princess of Wales seen meeting the families of Windrush generation members
2021,"Pictured: the Windrush monument, which was unveiled in Waterloo station in June 2022 by the Prince and Princess of Wales"
2022,"Kate Middleton has been spotted several times wearing the ‘Larsson’ wool jacket, which offers tailored simplicity at its finest thanks to its classic silhouette and neutral colourway"
2023,Ray of sunshine! Another racegoer opted for a bright yellow dress with a Kate Middleton inspired white jacket
2024,"Catherine, the Princess of Wales, has dazzled in dots at many major royal events, frequently reaching for the playful print. Pictured: At the D-Day exhibition at Bletchley Park in May 2019"
2025,The Princess of Wales led the way in polka dots for the Royal Order Of The Garter Installation Service at Windsor Castle on June 19
2026,The Princess of Wales picked an elegant polka dot shirt dress by Emilia Wickstead for the launch of the Tiny Happy People initiative in July 2020
2027,"During a visit to the Stewards Academy with HeadsTogether on September 16, 2016 in Harlow, the Princess of Wales wore a £1685 Altuzarra powder blue dress"
2028,"Kim Winser thought Kate Middleton's outfit, which featured Winser London's soft blue pussybow blouse with a matching coat, demonstrated skill in putting clothes together in a modern way"
2029,"Catherine, Princess of Wales meets with Paul McCartney and his wife Nancy Shevell during the reopening of the National Portrait Gallery"
2030,Kane created a bespoke coat dress and hat (pictured) for the Princess of Wales to wear to a Buckingham Palace garden party in 2017
2031,"Michael and Carole welcomed their first child, Catherine, or Kate, Middleton, the future Princess of Wales"
2032,"A heartwarming family photo of Michael and his daughter, Kate Middleton as a baby"
2033,Princess Beatrice seated next to her husband Edo joined the Prince and Princess of Wales in the Royal Ascot carriage procession today
2034,Princess Beatrice and the Princess of Wales chat as they stand on the grass of the royal enclosure following their carriage ride on the fourth day of Ascot
2035,"The Princess of Wales, 41, wore a scarlet Alexander McQueen dress and a Philip Treacy hat in a matching shade, smiling at crowds as she walked alongside Princess Beatrice"
2036,"In bright Berkshire sunshine, the Prince and Princess of Wales, left, joined William's first cousin Princess Beatrice and husband Edo for the traditional parade"
2037,A smiling Edo can be seen next to his wife Princess Beatrice as the pair sat opposite the Prince and Princess of Wales for the Royal Parade at Ascot on Friday
2038,The Princess of Wales stunned in scarlet as she arrived in the royal procession on the final day of Royal Ascot 2023 in a carriage alongside Prince William
2039,The Princess of Wales and Queen Camilla looked animated as they chatted to each other on the lawn as they arrived for an afternoon of fun
2040,"Lieutenant Commander Rob Dixon (right) was snapped in April 2021, near the the Princess of Wales during the funeral of Prince Philip, Duke of Edinburgh at Windsor Castle"
2041,"Along with the Camerons, the Prince and Princess of Wales joined racegoers at Royal Ascot when they took part in the traditional carriage procession with the King and Queen"
2042,"The Princess of Wales, who was stunning in a scarlet Alexander McQueen dress, gave Prince William a cheeky tap on the bottom as they got ready to present a trophy on the penultimate day of Royal Ascot"
2043,A royal thumbs up! The Princess of Wales appeared to respond positively to the Duchess of Edinburgh as they sat together in the royal box
2044,"Prince William, Prince of Wales and Catherine, Princess of Wales on stage to present the Commonwealth Cup on day four of Royal Ascot"
2045,"Prince William, Prince of Wales and Catherine, Princess of Wales on stage to present the Commonwealth Cup on day four of Royal Ascot"
2046,The Prince and Princess of Wales gazed intently at the trophies as they prepared for the presentation on the penultimate day of the racing festival
2047,The Princess of Wales greeted jockey Oisin Murphy after he won The Commonwealth Cup on Shaquille and was presented with a trophy
2048,The Princess of Wales greeted jockey Oisin Murphy after he won The Commonwealth Cup on Shaquille and was presented with a trophy
2049,A royal round of applause! The Prince and Princess of Wales beamed as they applauded the winning jockeys following the races
2050,Princess of Wales at Royal Ascot
2051,Princess of Wales at Royal Ascot
2052,The Princess of Wales appeared pensive as she chatted to another race observer in the royal box as the excitement got underway
2053,The Princess of Wales and Queen Camilla looked animated as they chatted to each other on the lawn as they arrived for an afternoon of fun
2054,"The Princess of Wales and Princess Beatrice both beamed as they entered the racecourse, with Beatrice sporting a white lace frock with flashes of colour"
2055,The Princess of Wales appeared deep in conversation with another racegoer dressed in a hot pink frock
2056,Princess of Wales at Royal Ascot
2057,The Princess of Wales stunned in scarlet as she arrived in the royal procession on the penultimate day of Royal Ascot 2023 in a carriage alongside Prince William
2058,Princess Beatrice seated next to her husband Edo joined the Prince and Princess of Wales in the Royal Ascot carriage procession today
2059,The Princess of Wales and Princess Beatrice waved to racegoers and royal fans as they took part in the royal procession
2060,"The Princess of Wales looked stunning in red, in a look that deviated from her usual Royal Ascot outfits, an event at which she has previously chosen to wear more muted, pastel tones"
2061,"The Princess of Wales sat in the royal procession alongside her husband, Prince William, who looked sharp in a top hat and tails"
2062,The Prince and Princess of Wales looked picture-perfect in the sunshine as they arrived at the festival for an afternoon of action
2063,The Prince and Princess of Wales joined the royal succession with Kate in a red Alexander McQueen dress and Sezane earrings
2064,The Princess of Wales and Princess Beatrice waved to racegoers and royal fans as they took part in the royal procession
2065,"Pippa, the Princess of Wales' younger sister, married billionaire James Matthews in 2017. The pair are pictured together at the wedding of Prince Harry and Meghan Markle"
2066,"James Middleton, younger brother to Pippa and the Princess of Wales, is pictured at Glen Affric, where he has hosted visitors. He is pictured in the Scottish Highlands with his wife, Alizee, and their dog, Mabel"
2067,"Freya Ridings, playing at Glasto has revealed her amazement at being asked to give a private performance by one of her biggest fans ¿ the Princess of Wales"
2068,"Singer-songwriter Freya, 29, said it was a ¿really, really intimate event¿, adding: ¿They were very humble, lovely, down-to-earth people and I got to meet the family and their little children.¿ Pictured, The Princess of Wales at the National Portrait Gallery"
2069,The new Prince and Princess of Wales have no plans for a property in Wales but will ‘support the tourist economy’ by renting cottages and booking bed-and-breakfast rooms
2070,He may have won 20 Grand Slam titles ¿ but Roger Federer (right) proved no match for the Princess of Wales (left) when they met on a Wimbledon tennis court
2071,Pictured: Princess of Wales and Roger Federer during a visit to the All England Lawn Tennis Club in Wimbledon for a behind-the-scenes look at work of the ball boys and girls who are a key part of the tennis tournament
2072,"At Ascot, Kate Middleton donned an all-red ensemble that not only looked breathtaking but made her stand out in the crowd"
2073,A royal round of applause! The Prince and Princess of Wales beamed as they applauded the winning jockeys following the races yesterday
2074,Feeling green: Kate Middleton stepped out in a £325 silk cream and green polka dot dress from LK Bennett for an outing to Evelina Children's Hospital in London in December 2018
2075,"Kate Middleton, 38, paid tribute to her late mother-in-law Princess Diana wearing a £525 Beulah London gown days after her birthday"
2076,Princess of Wales in her role as Colonel of the Irish Guard attendsthe 2023 St. Patrick's Day Parade at Mons Barracks wearing the Gold Shamrock Brooch
2077,"Princess Diana, Princess of Wales attending a gala at the Vienna Burgh Theatre in 1986 wearing the brooch as a pendant necklace"
2078,"Diana, Princess of Wales, wore a replica of the brooch"
2079,"Catherine, Princess of Wales wears the leek brooch as she visits he 1st Battalion Welsh Guards at Combermere Barracks for the St David's Day Parade on March 1"
2080,"When Catherine, Princess of Wales, wore polka dots to the Garter Service at Windsor, there were immediate, but misplaced, comparisons with Diana"
2081,"Liz Jones says here are no meaningful style comparisons to be made between Diana, pictured here in 1986, and Catherine, Princess of Wales"
2082,The Princess of Wales is very much her own woman and should be allowed to forge her own path. Kate is pictured here at this year's Commonwealth Day Service
2083,"But the truth is that there are only so many couture-level designers to go round, says Liz Jones. The Princess of Wales is pictured greeting Crown Princess Victoria of Sweden in 2018"
2084,"Diana, Princess of Wales in Nottingham in 1992"
2085,"Diana, Princess of Wales during a visit to the homeless charity The Passage with her sons, (then) Prince Harry (2nd left) and Prince William (2nd right) in the early 1990s"
2086,"William was introduced to homelessness by his late mother, Diana, Princess of Wales, at the age of 11 on a secret visit to a homeless shelter run by The Passage, of which he is now patron. Pictured: Diana speaks at the Centrepoint Conference for the Homeless in 1995"
2087,"Choo's fans include Catherine, Princess of Wales"
2088,"Kate, Princess of Wales, wore a wide-brimmed hat with blooming flower detail in the same shade of scarlet as her Alexander McQueen dress for day four of Ascot"
2089,The Princess of Wales pictured with Roger Federer as they played on Wimbledon's Number 3 court last month
2090,Kate Middleton seen presenting Roger Federer with the runners-up trophy at the Wimbledon men's final in July 2019
2091,Pictured: Roger Federer and his wife Mirka seen arriving at Kate Middleton's sister Pippa's wedding in May 2017
2092,The Princess of Wales pictured with Roger Federer as they played on Wimbledon's Number 3 court last month
