,0
578,"Since last June, Harry and Meghan have done much damage to relations with the Royal Family."
579,"Prince Harry (pictured with his wife Meghan)and others are suing Mirror Group Newspapers (MGN), publisher of the Daily Mirror, Sunday Mirror and The People, over stories they claim were the result of phone hacking or other illegal information gathering. The paper denies the claims"
580,The young woman left judges Kyle Sandilands and Meghan Trainor (pictured) speechless as she sang the K-pop hit acapella while performing choreography.
581,"Priyanka (right) attends the wedding of Prince Harry and Meghan Markle in 2018 (pictured with Abigail Spencer, left)"
582,"Harry writes in his new memoir Spare his father Charles, then Prince of Wales, discouraged him from attending university and instead suggested he take a gap year. Charles told his son he was not 'the intellectual of the family'. Harry is pictured with wife Meghan in Sydney in 2018"
583,"Harry is seen with his son, wife Meghan and her mother Doria Ragland at his first birthday in 2020"
584,"Prince Harry delayed replying to the invitation to the Coronation because he was 'preoccupied' by where he would have to sit, sources have indicated. Pictured: Prince Harry and Meghan Markle at St Paul's Cathedral in London on June 3 last year"
585,"According to Mark Hodgkinson in Serena: A Graphic Biography of the Greatest Tennis Champion the women's friendship evolved through regular phone calls and texts. Serena told Meghan to 'stop being so nice', according to Hodgkinson. Pictured: Serena and Meghan at the DirecTV Beach Bowl in 2014"
586,"Meanwhile, if her podcast Archetypes in anything to go by, Meghan could bring her celebrity appeal to the new version of The Tig"
587,The couple's suspected bodyguard appears to open the car door for Meghan
588,Meghan holds her award in her hand as she and Harry exit the Ziegfeld Ballroom
589,Meghan Markle met Prince Harry at Soho House in 2016 and claims she had only the most cursory knowledge of who he was
590,"The Queen, Meghan, and Harry, watching a flypast to mark the centenary of the Royal Air Force from the balcony of Buckingham Palace on July 10, 2018"
591,Prince Harry and Meghan Markle have been branded the most annoying celebs - just weeks after the release of their multimillion-dollar Netflix special criticizing the royal family
592,Judge Meghan Trainor initially gave the teenager a 'no' but later regretted her decision
593,"Mr Enninful (pictured with Meghan), 51, will be taking on a new global role at the publisher Conde Nast"
594,"Imagine Harry and Meghan's pre-publication fantasies! Surely they imagined the world at their backs, outraged that Harry got the smaller bedroom at Balmoral and that Charles isn't much a hugger, doubtless agitating for the end of the monarchy while applauding Harry and Meghan for bearing such suffering so valiantly."
595,The King is said to be 'very disappointed' that he will not see Meghan or his two young grandchildren at the Coronation - but happy that Harry will be able to make it
596,"Meghan and Jacinda Ardern appeared to have a budding friendship, sparked during the New Zealand Royal tour in 2018"
597,"In the Harry & Meghan Netflix reality show — excuse me, docuseries — Meghan theatrically mocked what it was to curtsy to the late Queen, her pained husband looking on dumbly."
598,Queen Camilla wore a Anna Valentine coat dress she first wore to Prince Harry and Meghan Markle's coat dress
599,Prince Harry and Meghan Markle have referred to each other as 'my love' several times in public too
600,"'Oh dear': Clarkson penned: 'I've rather put my foot in it. In a column I wrote about Meghan, I made a clumsy reference to a scene in Game of Thrones and this has gone down badly'"
601,Meghan at the Women of Vision Awards 2023
602,"Meghan Martin , from Florida,has warned about the dangers of wire grill brushes after a four-year-old boy presented a mysterious illness when he ingested metal pieces from one"
603,"Prince Harry and Meghan Markle married at St George¿s Chapel in Windsor on May 19, 2018"
604,Sisters Jorja (left) and Meghan Fox died in the car crash outside in a shocking crash just outside of Hamilton. Meghan was killed and Jorja remains in a serious but stable condition
605,"Meghan revealing that, actually, she was not ¿OK¿ and Harry¿s frank observations about his fractured relationship with his brother came as bombshells to the rest of the royal family"
606,"Meghan Markle, 41, ditched her monochrome style last night as she wore a gold ensemble for the first time ever in public"
607,Meghan Markle pictured in a purple dress and red coat as she arrives at a community centre in Birkenhead with Prince Harry in January 2019
608,"'Harry was somebody special and it was a pleasure working with him. Then suddenly he met Meghan and did a 180 turnaround,' he told host Sarah Harris. Pictured: Prince Harry and Meghan Markle"
609,Meghan and Harry in their recent Netflix series
610,"Looking great!Meghann Fahy, Britt Lower and Ayo Edebir posed inside"
611,"Meghan's Moon is in the sign of balance and fairness, Libra in the 3rd House of every day communication. The Duchess's Ascendant is in the caring Sign of Cancer at 24 degrees and her Sun Moon Mid-Point is at 8 degrees Virgo in the 2nd House"
612,"Rebel said in the video, 'Our next package is for Outstanding British Film. From drama to horror to fantasy, Harry and Meghan's interview with Oprah had it all.' (Pictured: Harry and Meghan's televised interview with Oprah Winfrey in 2021)"
613,Meghan Markle wore sheer black Erdem dress during a January 2016 appearance on NBC's Today
614,"During her interview with Watch What Happens Live last week, Rebel admitted that Meghan's cold demeanour may have been due to her mother Sue Bownds (left) asking her some personal questions"
615,"Meghan wore a mixture of two seasons in this photograph from December 2018: a wintery £500 wool coat by Canadian brand Soia & Kyo and a short sleeved £834 summer dress by American label, Brock collection"
616,"Harry, played by Richard Goulding is filmed chatting to wife Meghan, played by Kathryn Drysdale, for Sunday's Coronation special edition of The Windsors"
617,"However Meghan showcased a new, thinner band, more in keeping with her love of dainty jewellery, in 2019"
618,"When attending the Prada The Iconoclasts event at the Prada store in Soho in New York City, Meghan donned a fashionable pair of Prada shoes"
619,"Down and out in Beverly Hills: Initially, Meghan's head is nowhere to be seen as her character Wendy makes the most of pleasuring high school hunk Ethan"
620,"Meghan, Harry and Kerry Kennedy at the Ripple of Hope Award Gala in December. They were honored by Kennedy for their work fighting 'racial injustice'"
621,"Harry and Meghan continue to rake in huge sums since Megxit, with Spare being the latest money spinner"
622,"His son, Jasper, is Prince Harry's godson, who served as a page boy at Harry and Meghan's wedding in 2018"
623,"The Sussexes were joined at the gala at the Ziegfeld Ballroom in New York last night by Meghan's mother, Doria Ragland"
624,"Harry claimed in Spare that Meghan purchased a first class Air NZ ticket from Mexico to Britain for her father Thomas Markle, but the airline does not operate that route"
625,Prince Harry and Meghan Markle pictured with son Archie in Cape Town in September 2019
626,"'If the past two months have taught the King anything, it must surely be that Harry and Meghan are on a destruction mission and negotiation is futile'"
627,"Metropolitan Police chiefs previously insisted to the court that their officers are not 'guns for hire' for the rich and famous, claiming that allowing Harry to pay for the protection of officers - potentially armed ones - would set an 'unacceptable precedent' (Pictured: Prince Harry and Meghan Markle with security in Rotorua, New Zealand, in 2018)"
628,"Now, nine years after appearing in the I Wanna Marry Harry, she has reflected on her win in a new interview with Insider , she said she finally feels 'vindicated' knowing he went on to wed an American 'B-list' actress like Meghan"
629,Clarkson closed the farm shop after he caused outrage over his comments over Meghan Markle - but opened its doors again to mark the launch of the second series of his Amazon show
630,"The Duchess of Sussex (pictured) is currently in a legal battle with her half sister Samantha Markle, who has accused Meghanof defaming her in order to 'cover up' her 'false rags-to-riches' narrative"
631,"Meghan seemed to take inspiration from the Princess of Wales's look, wearing a similar jumpsuit in July that same year"
632,"Sore winner? Despite her hit TV show earning one of the evening's most competitive categories, the actress was accused of looking 'annoyed' and 'p**sed off' as she stood alongside Theo James, Meghann Fahy, and Will Sharpe and Jon Gries"
633,The release of the Harry & Meghan docuseries sparked a transatlantic war of words over whether the Royal Family were given the chance to properly respond to incendiary claims made by the Sussexes (pictured in Episode 2 of Harry & Meghan)
634,"Former couple: Jim and Meghan, shown in December 2018 in Missouri, were married from October 2014 to May 2021"
635,Meghan Markle is spotted at Portia's birthday party
636,"Prince Harry will be relegated to the third row with his cousins inside Westminster Abbey today for the Coronation of his father King Charles III, it has been revealed. Pictured: Prince Harry and Meghan Markle at St Paul's Cathedral in London on June 3 last year"
637,"Inside the House of Windsor episode 5, which airs on Thursday evening on ITVX, plays footage from Prince Harry and Meghan Markle's wedding, including the sermon delivered by Rev Michael Curry"
638,"According to royal biographer Tom Bower, Meghan's insistence about the bridesmaid dresses and tights was supported by her friend Jessica (pictured)"
639,It comes following the public falling out between the Sussexes and the rest of the Firm. Pictured: Queen Elizabeth II and Meghan Markle depart Chester Town Hall during a visit in June 2018
640,"Meghan rubs her husband's face and laughs as they enjoy a date night, with their staff"
641,"Royal analysts claim Harry, 38, had a heartfelt talk with his father on Saturday, but has not addressed the ongoing dispute with William. It is also understood that there will be no time for the pair to meet during the trip. Pictured: Harry, Meghan, William, Kate and Charles in 2020"
642,"Moehringer is believed to live in Berkley, California around 300 miles from Harry and Meghan's Montecito mansion"
643,"'She [Meghan] would still be a waitress if it wasn't for dad,' half-sister Samantha Markle, 58, says in a newly released trailer."
644,"Channel Seven has announced a significant change to Australian Idol, as they broaden the hunt for the next singing superstar. Pictured L-R: Kyle Sandilands, Meghan Trainor, Amy Shark and Harry Connick Jr."
645,"Oh, the relief and joy upon last night’s breaking news: Harry and Meghan (pictured with the late Queen in 2018), according to an insider, declared themselves done: ‘Nothing left to say.’"
646,Scans of Meghan's jaw show how the procedure effectively straightened her teeth and corrected her overbite
647,"Harry and Meghan relocated from the UK to California in early 2020, and have, since early 2021, been raising their two children, Archie and Lilibet, in a $14.65 million mansion in Montecito - thousands of miles away from the Duke's family"
648,The Duke of Sussex revealed in his tell-all interview with Gabor Maté that Meghan Markle saved him from royal life - claiming he was 'stuck' before she drew him out
649,"The most recent famous face to visit San Vicente Bungalows was Prince Harry - along with his wife, Meghan - who were photographed entering the upscale eatery together earlier this week"
650,Eugenie was even the only member of the Royal Family to feature in personal photos shared in Harry and Meghan's Netflix documentary released last year. The couple pictured in 2018
651,Harry and Meghan have managed to make an estimated £100million since moving to the US
652,"After their Netflix documentary, Harry and Meghan are looking to make their own royal rom coms as they look towards making more 'feel-good' TV entertainment"
653,"Jessica, the one-time best friend of Meghan, visited an exclusive Mayfair restaurant as she continued her trip to London earlier in the trip"
654,"King Charles was displayed alongside his wax figure family, William, Kate, and Harry, as uniformed guards stood at their sides, however, Meghan's waxwork was notably missing"
655,"In 2020 Fox was embroiled in another row as he rolled his eyes and looked to the ceiling on Question Time when he denied that treatment of Meghan Markle was racist, declaring 'Oh my God' when called a 'white privileged male'"
656,Harry and Meghan later swapped their first home Nott Cott for ten-bedroom Frogmore Cottage on the Queen's Windsor Estate
657,"Like Prince Harry and Meghan Markle more than a century later, he lived at Frogmore Cottage in the grounds of Windsor Castle, and also had his own set of rooms at the Queen's beloved Osborne House. Above: Frogmore Cottage in 1872"
658,"Meghan wore the heels, which cost £490 and come with an elegant black detail on the back, on a number of occasions"
659,"In the article, published last December, the columnist said he was dreaming of the day when Meghan would be paraded naked through the streets of Britain and pelted with ¿excrement¿"
660,"Harry and Meghan arriving at Windsor Castle to view flowers and tributes to the late Queen on September 10, 2022"
661,"Jeremy Clarkson has been axed as the host of Who Wants To Be A Millionaire, ITV confirmed today, following the presenter's highly controversial Meghan column"
662,"Prince Harry and Meghan Markle's popularity slumped to an all-time low in the US, where they are now even less popular than disgraced royal Prince Andrew, a shock poll found"
663,Harry and Meghan spoke to Oprah in 2021 about their life inside the royal family
664,During the Netflix seriesMeghan appeared to mock her own efforts at following royal protocol as she recounted the 'surreal' moment she first met the Queen
665,Prince Harry and Meghan Markle at the Ms Foundation Women of Vision Awards at Ziegfeld Ballroom in New York last night
666,"The Sussexes were joined by Meghan's mother, Doria Ragland, for the event last night"
667,"Meghan wore the earrings on the first day of her Australian tour in 2018 with Harry, the day after announcing that she was expecting her first child"
668,"Assuming US police would guard them in California, Harry and Meghan found, to their cost, that the American Security Services rarely indulge in frivolities"
669,Prince Harry and Meghan Markle have both seen their approval ratings drop dramatically since the beginning of December
670,Millie Mackintosh and Meghan Markle pictured together at Soho Farmhouse in Oxfordshire in 2016
671,Prince Harry told Tom Bradby that the Princess of Wales was among members of the Royal Family who 'stereotyped' his wife Meghan Markle when they first started dating
672,"Harry and Meghan's Archewell foundation has donated £10,000 in a bid to place a diverse book of 'raw' and 'inspirational' stories from ethnic minorities into every state secondary school in the UK"
673,"It is excoriating. Though no fan of Meghan, even I thought the cruelty went too far in places. But satirical comedy doesn't work unless it has some element of truth"
674,Mini Meghan Markle
675,Donald Trump said he was 'not a fan' of Meghan during a White House press conference
676,"Royal Love Actually: While Harry and Meghan have very much escaped the snow in London for sunshine in Montecito, California"
677,"Meghan Markle appeared in a commercial for the beer company in 2010, but did not appear in a bikini"
678,Meghan is spotted hiking with friends - the first time the Duchess has been seen in public since King Charles' coronation
679,"Meghan, Duchess of Sussex, was all smiles as she left Gracias Madre in West Hollywood after an International Women's Day celebration"
680,Guy Pelly pictured behind two other wedding guests withTom 'Skippy' Inskip - who reportedly fell out with Prince Harry after voicing concerns about his relationship with Meghan
681,Dress Up Meghan sticker book
682,"Last January, in another episode of Simmons' podcast, he blasted Harry, saying it was 'embarrassing' to be affiliated with the same company. Meghan and Harry are seen at theMs. Foundation Women of Vision Awards in New York,May 16, 2023"
683,"In good company:The former Victoria's Secret angel was joined on the red carpet by Kim Kardashian, Meghann Fahy, Keanu Reeves, Brie Larson, Elle Fanning, and Gwyneth Paltrow."
684,He was also spotted standing behind Harry and Meghan at the Platinum Jubilee celebration National Service of Thanksgiving at St Paul¿s Cathedral last June
685,Danielle De Niese - the opera star married toGus Christie -says Meghan should have followed her example
686,She appeared all smiles - despite suffering from heavy criticism in the book from both Harry and Meghan
687,Meghan and Harry reportedly signed a deal worth $20 million with Spotify in 2020
688,"Harry has been dedicated to maintaining his privacy and that of Meghan and their children, Archie (pictured with parents), three, and Lilibet, one"
689,"She added that Princess Diana would be 'proud of him and her lovely grandchildren', saying of Meghan: 'She really loves him, and I think that's beautiful'"
690,"Meghan wore the Cartier Tank watch, as pictured, gifted by Harry that once belonged to Princess Diana"
691,"Meghan went to India with World Vision, working on menstrual health management and education access for young girls, according to the memoir"
692,"In the short clip, Meghan and Sarah sport virtual dog ears and noses, with long pink tongues emerging as they smile"
693,"Kate found her Windsor walkabout with Harry and Meghan after the Queen's death 'one of the hardest things she'd ever had to do', a sensational new royal book recently claimed"
694,"Last summer, a new @Meghan handle appeared on Instagram. After fans of the star rushed to follow the page, its profile picture was changed to a pink dahlia"
695,Damning figures show Aussies are losing interest in Prince Harry and Meghan Markle after the Duke trashed his family in 'truth bomb' interview
696,"Meghan, Duchess of Sussex, was wearing a custom Louis Vuitton dress (estimated at £8,000), Princess Diana¿s aquamarine ring (worn before, no estimate), Carolina Herrera earrings (£155), a Givenchy clutch worth £1,500 (worn before) and her Cartier bracelet worth £6,350 (worn before) in rainy New York in December for an award ceremony. Her outfit total for the look is £16,005"
697,"When told he no longer qualified for its protection after leaving for America with wife Meghan Markle, his offer to pay for it was declined. (Pictured: Harry and Meghan in New York in September 2021)"
698,"A blog post from Meghan Markle's now defunct website The Tig referred to the extravagant wedding of Prince William to Kate Middleton in 2011, and the Duchess seemed to take a dim view of 'childhood fantasies' about fairytale princesses"
699,"It is a royal residence that has been in the headlines for all the wrong reasons. Earlier this year, the Palace told Prince Harry and Meghan Markle to vacate Frogmore Cottage"
700,"The Duke of Sussex, 38, claimed in his explosive memoirs Spare, published officially on Tuesday, that Prince William, 40, was meant to spend the night with him and friends at the Coworth Park Hotel on the eve of his wedding to Meghan Markle on 19 May 2018. Pictured: The brothers on Harry's wedding day"
701,"It was not until 2019 that Meghan Markle wore an Erdem look on an official engagement, when she wore this custom green coat dress"
702,"Kate Middleton and Meghan Markle have had issues in the past, detailed in Harry's memoir"
703,"The streaming service started bouncing back after the cancelation of some of its progressive programming, including Meghan Markle's Pearl, Dr. Ibram X. Kendi's Antiracist Baby and He's Expecting, which depicts a man who becomes pregnant (pictured)"
704,"Jessica later faced accusations that she had used Meghan as her 'superpower,' though denied this was the case and refused to speak about the Duchess in interviews. Both pictured in 2016"
705,Prince Harry says he didn't ask his girlfriend to curtsey for his brother as he 'loved Suits'. Pictured: Meghan posing for a Season One Suits cast photo
706,Relaxed tailoring: Meghan pictured in 2016 sporting a Veronica Beard Beatriz blazer and short suit combination
707,The director of Harry and Meghan's Netflix docuseries claims Buckingham Palace tried to 'discredit' the couple's bombshell allegations by claiming the filmmakers did not contact the royals for comment. The Sussexes are pictured in the show
708,Loose Women panellist Denise Welch (pictured on today's show) revealed she will not be taking up the invitation to pledge allegiance to King Charles during the coronation this weekend and instead would prefer to declare her loyalty with Harry and Meghan
709,"Speaking to Tom Bradby, the duke accused William and Kate of 'stereotyping' Meghan"
710,"This week the satirical animation series South Park brutally lampooned them with an episode in which a couple ¿ one with a ginger beard, the other unmistakably Meghan ¿ undertake 'The Worldwide Privacy Tour'. He's carrying a placard saying: 'We Want Our Privacy!!' She's holding one that says: 'Stop Looking At Us!'"
711,Harry and Meghan are pictured in Frogmore Cottage shortly after the birth of Archie
712,"The barrister and her husband were among the 600 who were invited to Prince Harry and Meghan Markle's 2018 wedding in Windsor, pictured"
713,"Snub:In recent days, it has also been claimed that Taylor turned down an invitation to appear on Meghan Markle 's podcast despite receiving a 'personal letter' from Duchess"
714,"Meghan Markle joined the royals in Kent for a service at Westminster Abbey, London to mark the 100th Anniversary of the Royal Air Force"
715,"Sealed with a kiss: Haley 27, was spotted backstage puckering up with Meghann Fahy at the SAGs on Sunday evening"
716,"During her interview with Watch What Happens Live last week, Rebel revealed she and her mother Sue Bownds were introduced to the royal couple by a mutual friend. (Pictured: Meghan Markle in theNetherlandson April 17, 2022)"
717,The doppelganger - who signed to an agency in 2017 - had thought Harry's 2020 bolt for the US with wife Meghan Markle would kill off his livelihood
718,"Little August - who is 13th-in-line to the throne - was born in February 2021 and is only several months older than Harry and Meghan's daughter (pictured), who was born in June 2021"
719,Meghan signed off her 12th episode in the Archetypes podcast series with a defiant piece of poetry about survival
720,And dozens of social media users - includingsinger Meghan Trainor - have flooded to the comments to heap on the praise for the four-year-old
721,"The Duke and Duchess of Sussex (pictured) on Monday rejected Clarkson's apology for his column in The Sun newspaper in which he said he hated Meghan 'on a cellular level', and dreamt of her being paraded naked through British towns and publicly shamed"
722,"David Olusoga,who appeared in Prince Harry and Meghan Markle's bombshell Netflix series, received an honour from King Charles at Windsor Castle yesterday"
723,Prince Harry said the Royal Family 'weren't expecting him to get into a relationship with someone like Meghan Markle'. Pictured: the couples in November 2018
724,"For the wedding ceremony atSt George's Chapel, Windsor, on May 19, 2018, Meghan wore a pure white silkGivenchy dress"
725,"Billionaire Michael Bloomberg's daughter Georgina has revealed her family is anti-Sussex, telling DailyMail.com her mom would 'never forgive her' if she worked with Meghan and Harry"
726,"The actress met Prince Harry in 2016, getting engaged the following year. Pictured: Prince Harry and Meghan Markle leaving St George's Chapel in Windsor Castle after their wedding"
727,"Meghan carried a $1,100 Metropolitan Insignia clutch from Carolina Herrera (seen) and added a further touch of gold to her look with her $7,350 Cartier Love Bracelet"
728,"Prince Harry and Meghan Markle have been labelled 'Hollywood nobodies' by one royal author after seemingly failing to attend Oscar parties. The couple, who are based in Montecito, California, were nowhere to be seen at Sir Elton John 's AIDS Foundation's 31st Annual Academy Awards Viewing Party. Pictured, the royal and the singer in 2018"
729,"Tonight's extraordinary revelations about Kate's role in the palace's response to Harry and Meghan's interview comes as William and Harry both gave separate speeches congratulating the winners of the Diana Awards during a virtual ceremony shared online today. The Prince of Wales, 41, appeared first during the 43-minute streamed event by praising the 'courage, compassion and relentless dedication' shown by the young people who had been honoured"
730,Friends:Her next photo showed both herself and John with a couple different friends including Crazy Ex-Girlfriend writer Rachel Specter as Made You Look by Meghan Trainor played over the picture
731,"Meghan got her steps in for the day as she went on a hike with her friends, one day after Archie's birthday"
732,"Donna Werner (centre) andFaith Nicholson (left) spent four nights as campsite neighbours ahead of William's wedding to Kate in 2011. They reunited again, seven years later, when Harry married Meghan. They are pictured ahead of the Sussexes' wedding"
733,"Candid:Meghan recently got candid about her traumatic birth story in her upcoming book, Dear Future Mama; seen in 2022"
