,0
0,Neo-Nazi podcasters who said Prince Harry and Meghan's son Archie is an 'abomination that should be put down' for being mixed race are convicted of terror crimes
1,"Truth behind THAT awkward 'mum's day out': As Kate returns to the polo to support William, how her 2019 outing with Meghan was an effort to show a united front before their feud was exposed"
2,Harry's 'band of brothers'! Who's who in Prince's close circle - after he missed the wedding of Jack Mann despite rumours his polo pal was his 'secret best man' at wedding to Meghan
3,Prince Harry and Meghan Markle hold hands and share a laugh and joke together in Santa Barbara as they are spotted for first time since it emerged they have handed over keys to Frogmore Cottage
4,"As rumours swirl that Harry and Meghan's Netflix deal could be axed, other royals who've proved a TV flop, including Prince Andrew's Newsnight disaster and Edward's panned 'It's a Royal Knockout'"
5,Planet Sussex: How Prince Harry and Meghan's circle of close friends has changed over the years... so who's in and who's out of their orbit?
6,"Meghan and Harry 'believe they have been ""repeatedly unlucky"" and blame Covid, economic woes, the death of the Queen and the failing of Prince Philip's health for their faltering attempts to launch post-royal careers'"
7,"ALISON BOSHOFF: Just as Meghan hires a Hollywood powerbroker to boost her career, Harry is returning to his campaigning roots... So is the prince tiring of his wife's showbiz world?"
8,Press watchdog upholds a complaint about Jeremy Clarkson's controversial newspaper column attacking Meghan
9,Could the Harry and Meghan 'double act' be over? PR experts say Duke and Duchess may embark on more solo projects to 'play to their strengths' and 'avoid ridicule' - amid reports prince is making Netflix show about Africa on his own
10,Is there any coming back for Harry? Royal experts warn it will be hard for the Duke to 'assert any constitutional role in the UK' after his eviction from Frogmore - as he and Meghan finally hand over keys to the cottage
11,"Talented podcast people have 'lost their jobs', because of the huge money the industry spends on the likes of Harry and Meghan's Spotify deal - and there's 'a lot of anger', Rebecca English tells PALACE CONFIDENTIAL"
12,"What goes on tour, stays on tour... or does it? Royal hen and stag dos revealed - from Princess Diana and Sarah Ferguson being 'arrested' to Meghan Markle's low-key party at Soho Farmhouse"
13,EDEN CONFIDENTIAL: Why Meghan cheerleader Omid Scobie faces losing his company
14,Is Prince Harry about to go it alone? Duke 'is planning to film a new Netflix documentary about his beloved Africa without Meghan' as royal couple try to revive their flagging fortunes after their Spotify podcast was axed
15,Harry and Meghan will need to strike a 'private deal' with Charles to stay in royal residences again or 'they may have to rely on hotels and friends' during UK visits as they finally vacate Frogmore Cottage
16,Harry and Meghan finally vacate Frogmore Cottage: Sussexes return keys and their last possessions are shipped to California six months after they were booted out following release of duke's bombshell memoir Spare
17,Harry and Meghan's biographer Omid Scobie announces new book 'Endgame' about the Royal Family's 'fight for survival' will be released on November 21
18,Sir Trevor Phillips says Meghan Markle had to 'learn to be black' when she joined the Royal Family 'but made a bit of a mess of it' - after she grew up in wealthy LA district 'with race never part of her background'
19,Meghan Markle's CV before she hit the jackpot reveals the actress-turned-royal's 'special skills' as well as height and weight
20,DAN WOOTTON: Taylor Swift's brutal rejection of Meghan Markle's plea to appear on her podcast proves stars want proximity to real royals - not the bitter Sussexes. That's why I'm told Harry and the desperate Duchess will be dropped by Netflix next
21,"'Turns out Meghan Markle was not a great audio talent, or necessarily any kind of talent': Hollywood talent agency supremo Jeremy Zimmer dismisses Duchess as a talentless broadcaster after Spotify axed its £18m deal with the Sussexes"
22,Why DID Taylor 'snub' Meghan's handwritten podcast invite?Singer previously boycotted Spotify and her girl gang has a lot of VERY close connections to the royals
23,Taylor Swift allegedly snubbed invite from Meghan to appear on podcast
24,A-Dior-ing royals! How the French designer became a go-to for fashionable blue-blooded types like Harry and Meghan (and muse Princess Margaret started it all!)
25,How Taylor Swift 'snubbed handwritten invite from Meghan to appear on her Spotify podcast (letting her rep say no!) while execs rejected idea after idea from the subpar Sussexes'... though a Great Expectations-inspired Netflix show IS on the way
26,"So what's next for Harry and Meghan after £18M Spotify deal was axed? PR experts suggest Duchess could re-join social media, relaunch her lifestyle blog The Tig or return to acting... but they're BOTH in dire need of a rebrand"
27,Real Housewives host questions how Meghan Markle treated him on Spotify podcast: Andy Cohen says Duchess claimed his show 'fuelled negative stereotypes of women' then didn't put her allegations to him during interview
28,"Meghan Markle is more unpopular than ever: Seven out of 10 Brits have a negative view of Duchess of Sussex, as poll shows Anne, Kate and William are best-loved royals"
29,US officials refuse to grant Harry and Meghan's 'Archetypes' trademark
30,New business blow for Harry and Meghan as US officials REFUSE to grant their Archetypes trademark - barely a week after $20million Spotify deal was ditched
31,A subtle swipe at Meghan? Camilla raises eyebrows after wearing a DIOR ensemble to the first day of Ascot - after the brand denied rumours of collaboration with the Duchess of Sussex
32,ESPN analyst Stephen A. Smith claims no one cares about Prince Harry and Meghan Markle 'unless they're insulting their family' after his former colleague Bill Simmons branded them 'f***ing grifters'
33,Copy-Kate strikes again! Princess of Wales re-wears £645 Aquazzura heels favoured by Meghan Markle to reopen National Portrait Gallery
34,Meghan Markle is accused of faking interviews for axed Spotify podcast
35,PICTURED: Spotify exec Bill Simmons is seen for the first time since he publicly branded Harry and Meghan 'f***ing grifters' after their $20million Archetypes podcast was axed
36,Meghan is NOT in talks to become the 'Duchess of Dior': Sources deny rumours that she is in line for a mega-bucks deal with the French fashion house - as resurfaced clip from 2015 crime drama shows her playing perfume model
37,Meghan's Dior audition? Resurfaced clip from 2015 crime drama shows the Duchess of Sussex playing a perfume model - as she's rumoured to be in line for lucrative deal with the fashion house
38,"Revealed: the very Royal reason William and Kate love to match in blue outfits when they're out and about, but Harry and Meghan prefer a green tinge..."
39,Meghan Markle is accused of FAKING interviews for axed Spotify podcast: Industry sources claim the Duchess got staff to do chats with Archetypes guests then had audio of her voice edited in to the final episodes
40,"The team behind Meghan's multi-million dollar relaunch: Duchess enlists powerhouse agent who is friends with Dubai royals, his fashion designer wife and skincare guru who can 'build her into a global brand'"
41,"Business-like trouser suits, monochrome palettes and 'Democrat-friendly' white - is Meghan's wardrobe dropping a hint about her political ambitions?"
42,The Duke and Duchess of Dior? Experts say both Meghan AND Harry could be part of mega-bucks deal with French fashion house after Prince 'plugged' brand at Coronation - because couple 'realise it's easier to be clothes horses than issues warriors'
43,"Meghan Markle could become world's highest-paid influencer: Duchess could rake in £200,000 per post after befriending guru behind Cindy Crawford and JLo's beauty lines and could rival Kim Kardashian's Dolce & Gabbana campaign if she signs Dior fashion deal"
44,"Is Meghan about to become the mega-bucks Duchess of Dior? As Sussexes' Spotify gig goes south and observers wonder how they will fund their lavish lifestyle, Hollywood is abuzz with what may be the answer"
45,Downcast duchess: Make-up free Meghan Markle looks glum as she is spotted in public for first time since her $20million Spotify podcast deal ended and streaming service's head of innovation called her and Harry 'f***ing grifters'
46,"'It wasn't just a hobby, it was a really successful business...' As her Spotify deal falls apart, could Meghan Markle engineer a big-money comeback for lifestyle blog The Tig?"
47,Prince Harry and Meghan Markle are called 'f*****g grifters' by Spotify exec Bill Simmons after their $20M Archetypes podcast is axed
48,"End of Harry and Meghan's £18million Spotify deal after just one podcast series is a sign of 'post-Megxit wave' crashing, brand expert says"
49,Meghan only has Netflix left: £81m deal with streaming service is last surviving major deal in her media empire after Spotify dropped plans for a second series of her podcast
50,Why Harry and Meghan's brand could come crashing down: Experts warn Sussexes could lose up to $10m in deals after Spotify parted ways with royal pair - but Duchess could build an empire like Gwyneth Paltrow or the Kardashians
51,Meghan Markle's Archetypes podcast is axed by Spotify
52,"Prince Harry and Meghan Markle 'really are in exile' after 'significant' decision to not invite them to Trooping the Colour, Richard Eden tells PALACE CONFIDENTIAL"
53,Meghan Markle's Archetypes podcast is AXED by Spotify: Streaming platform and Sussexes 'agree to part ways' with royal pair 'set to lose full payout due to low productivity'
54,"EXCLUSIVE - Revolving door at Harry and Meghan's Archewell spins yet again as Duke and Duchess hire new assistant who worked at $2,600-a-night Montecito ranch where prince filmed bombshell interviews to promote memoir Spare"
55,British owner of luxury bike shop who turned up at Harry and Meghan's Montecito home and left a £240 cycle for Archie reveals his delight that couple kept it - and sent him a printed thank you note signed by a member of their team
56,Going flat-out for style! How Meghan Markle has proved that ballet shoes can be just as classy as heels
57,"DAN WOOTTON: Why is Meghan Markle not telling Prince Harry he's making a fool of himself? From his courtroom catastrophe to the horror of Spare, these kamikaze missions are destroying any credibility the Sussexes had left"
58,"Meghan and Harry's foundation gives £10,000 to fundraiser aiming to get book of 'inspirational' stories from ethnic minorities into every UK secondary school"
59,From fake friends... to fake grass? Millie Mackintosh whips up a social media storm as she reveals new artificial lawn - after claiming she was 'ghosted' by Meghan Markle
60,Spotify will cut 200 jobs from its podcast business as streaming giant reels from spending binge with £18m splurged on Harry and Meghan deal and £160m on Joe Rogan
61,Royal baby announcements through the ages: From easels to Instagram to podcasts (as well as THAT statement fiasco after Meghan Markle gave birth to Archie)
62,Meghan Markle's British etiquette teacher is 'appalled' and 'let down by' the Duchess
63,Why did Prince Harry and Meghan Markle call their daughter Lilibet? A look at the touching inspiration behind her name
64,Perfect hair-mony! How Meghan took inspiration from Kate with her royal hairdos - before finding confidence with her own style during her final engagements
65,"Prince Harry is seen as a 'loose cannon' by the Royal Family - while Meghan Markle appears 'set on destroying' the Institution, expert claims"
66,Prince Harry and Meghan Markle are branded 'low-grade reality stars' who only want to 'hang out with celebrities' by US broadcaster Tim Dillon
67,"'Harry and Meghan have plenty left to say': Royal experts say the Sussexes won't stop revelations in memoirs, documentaries and TV interviews because they 'specialise in doing the unexpected' and it 'helps their brand'"
68,"Abs just fab, Rita! Singer shows off her Pilates poses on £10,000 kit beloved by A-list stars Margot Robbie and Meghan Markle"
69,"Harry and Meghan 'are FINALLY going to stop writing books, making documentaries and sitting down for interviews to bash the Royal Family' claim insiders... because 'there's nothing left to say'"
70,"Princes William and Harry 'had secret meeting' with Diana's butler Paul Burrell ahead of Duke of Sussex's engagement to Meghan Markle, says royal source"
71,"Keeping their loved ones close - the personalised jewellery collections of royal women, from Princess Diana to Meghan Markle"
72,Meghan Markle SKIPS prestigious 'women in media' awards gala in LA - despite gushing about her Archetypes podcast being honored - one week after Sussexes were embroiled in controversy over 'near catastrophic' car chase claims
73,"Her 'brutal' twenties. Her 'unladylike habits'. And the time she only had $40 in her bank account... Meghan Markle's MOST revealing posts on her personal blog, The Tig. (Before she met Prince Harry)"
74,"The biggest Deal or No Deal controversies: From Meghan Markle's sensational 'bimbo' comments to claims of cheating its contestants, relive the game show's scandalous past as viewers gear up for its return"
75,Kate is the target of crude sexual insult in new Amazon spy drama starring Meghan Markle's friend Priyanka Chopra - days after Disney's new Little Mermaid movie 'aimed a dig at Princess'
76,"Her lace dress was stunning, but it was toddlers George and Charlotte who stole the show - how Pippa Middleton's big day unfolded six years ago (and the guest list drama involving Meghan Markle)"
77,Harry and Meghan demand US picture agency involved in 'near catastrophic car chase' in New York hand over images
78,"'Meghan in disguise' breaks chart record: Composer accused of being Duchess of Sussex undercover at the Coronation celebrates 1,000 weeks in the classical charts"
79,Rishi Sunak says Harry and Meghan's claims of 'near-catastrophic car chase' in New York are 'not really my priority'
80,Meghan's SECOND wedding gown was modest - but a decidedly slinky number that let her dance the night away with husband Prince Harry five years ago today
81,JAN MOIR: The 'near catastrophic car chase' is the Harry and Meghan story that's finally broken me
82,"Fatuous, irrelevant and no sense of purpose - what a fitting backdrop Manhattan's 'Women of Vision' made for the vapid La Markle herself! Fellow guest MAUREEN CALLAHAN's sparkling account of Meghan's word-salad gala appearance"
83,DAN WOOTTON: Meghan Markle 2.0 is focussed on a blancmange woke set of radical feminist priorities aimed at rescuing her reputation while getting richer. But it still begs the question: What has the privileged Duchess actually done?
84,"Meghan's mission to rescue Brand Sussex (in a £9,000 golden outfit): As the Duke and Duchess's popularity plunges in the US, they are pivoting from the dramas with the Royals while promoting her as a woman of substance, reveal RICHARD KAY and TOM LEONARD"
85,"Harry and Meghan involved in 'near catastrophic' car chase while in New York, spokesman claims"
86,'Stalker' is arrested lurking outside Harry and Meghan's Cali mansion
87,Disney's new Little Mermaid movie appears to make a dig at Kate - and the film just so happens to be a favourite of Meghan's
88,Prince Harry leads a smiling Meghan by the hand as couple leave her New York 'relaunch' speech to celebrate her golden moment - as body language expert says Duchess was in full 'goddess mode' and 'conducting her audience'
89,'Stalker' is arrested lurking outside Harry and Meghan's Montecito mansion in the middle of the night after their security staff placed him under a citizen's arrest
90,"Meghan 2.0 is a golden girl! Hidden meaning behind $1,850 Johanna Ortiz as Duchess ditches her monochrome style for metallic shades for first time EVER"
91,The mystery of Meghan's missing engagement ring: Duchess steps out WITHOUT her glittering trio of diamonds - after having band upgraded from Harry's original choice
92,"A little help for my friends! Inside Meghan and Gloria Steinem's close relationship as the feminist icon presents the Duchess, who she once called 'chosen family', with a 'global advocacy' award from her foundation"
93,Meghan uses Queen's mantra for her own crowning moment: Duchess hails 'service' as she accepts Women of Vision award at glitzy New York gala with Prince Harry by her side a week after Charles made it a key part of his Coronation pledge
94,"'You can be the visionary of your own life': Meghan hails 'acts of service, grace and kindness' as key to an 'equitable world' as she accepts Women of Vision award at NYC gala dressed in $1,850 strapless golden gown in front of Prince Harry and mom Doria"
95,"Golden girl! Meghan Markle dons very pricey $12,000 outfit at Women of Vision gala - including trendy $1,350 Tom Ford 'naked' shoes and a $1,850 dress by Colombian designer (which she had altered to remove the straps)"
96,EDEN CONFIDENTIAL: George and Amal Clooney give King Charles the royal seal of approval as they turn out for the Prince's Trust Awards - despite being close friends with Harry and Meghan
97,"Meghan Markle retells NYC gala story of how she enjoyed TV dinners and Jeopardy! after school, as she dons stunning $1,850 strapless gown to accept 'Women of Vision' award from friend Gloria Steinem while Prince Harry and mom Doria look on"
98,Not taking sides? Prince Harry and Meghan Markle's close pals George and Amal Clooney turn out to support King Charles' Prince's Trust Awards
99,"Getting some Goop tips? As Meghan Markle dines out with actress-turned-lifestyle guru Gwyneth Paltrow amid rumors she's set to relaunch her OWN website The Tig, FEMAIL lifts the lid on close connections between the two women - and their rival blogs"
100,Get ready for Meghan 2.0: Duchess poses for charity and dines with Hollywood royalty as she prepares to accept US 'racial inequity' award tonight - as experts say expect to see more of her with new celeb pals thanks to Kate's current charm offensive
101,"Ten times Meghan Markle and Kate, the Princess of Wales, chose a strikingly similar fashion look (even if they don't always see eye to eye!)"
102,Following in Meghan's footsteps! Sarah Ferguson says 'no topic is off the table' as she announces she is launching a podcast to 'spill the tea'
103,"What do the stars tell us about the Royal Family's relationships? The Queen and Philip were a match made in heaven, writes astrologer PATRICK ARUNDELL. But Harry and Meghan's close bond must survive the confusing energies of Neptune!"
104,Harry and Meghan step out for Michelin star sushi at their local restaurant in Montecito - one week after he dashed back to California from dad Charles' coronation for son Archie's 4th birthday
105,"She's fallen out with Meghan, but what did Kate think of Harry's exes? Princess 'wanted him to marry Cressida Bonas' but had an awkward relationship with Chelsy Davy"
106,"Watches to rival the crown jewels! The royals with VERY expensive timepieces - including Princess Diana's £17,800 Cartier Tank which was gifted to Meghan"
107,Meghan Markle's model friend Kelly McKee Zajfen pays tribute to 'incredibly warm and open' duchess for being an 'incredible friend and mother' who supported her after death of her nine-year-old son
108,"Made in Windsor: As Millie Mackintosh claims ex-friend Meghan Markle didn't want to be 'associated with Made In Chelsea', how the lives of the royals and TV's poshest reality stars are VERY intertwined"
109,'Her last message was abrupt:' Millie Mackintosh admits she felt 'snubbed' by former pal Meghan Markle when she met Prince Harry - after they 'bonded over their divorces'
110,'I've had the moustache since I was 18 years old!': Coronation guest accused of being Meghan Markle in disguise reveals the truth - as Andrew Lloyd Webber says 'I can confirm it probably wasn't MM'
111,Meghan and Harry 'hire Kim Kardashian's former bodyguard to protect them in California after firing minder who used to work for Michael Jackson'
112,Prince Harry's ghostwriter opens up about living with Duke and Duchess of Sussex while working on Spare - from Meghan's thoughtful gestures to Duke's 'scholar' knowledge of Moana
113,"Meghan Markle's biographer Omid Scobie claims George, Charlotte and Louis 'were to blame' for Kate and William being late to the Coronation"
114,'Is that a tummy flattener?' Meghan Markle baffles fans after sporting a mysterious accessory UNDER her shirt during LA hike - as social media speculates it's a weight loss aid or even a HERNIA belt
115,Who is Heather Dorak? Meghan Markle's devoted friend and Pilates instructor was by her side during Coronation weekend
116,"A high price hike! Meghan Markle wears £157,000 worth of jewellery including Princess Diana's £17,800 Cartier watch and $495 necklace that 'protects peace' for outing the day after missing the Coronation"
117,"As Meghan and Harry's first-born turns four, why did they name him Archie Harrison Mountbatten-Windsor? (And how does he come to be a Prince?)"
118,Missing the big party: Meghan Markle hikes without Prince Harry near $14M Montecito mansion as she is seen for the first time since skipping King Charles' coronation for Archie's birthday
119,Harry rushed home to LA to make it in time for Archie's birthday with his and Meghan's celebrity friends- as duchess tells friends it would've been 'inauthentic' of her to go to Coronation and miss son's birthday
120,'Tell Meghan I love her!' Princess Beatrice and Eugenie greet royal fans at the Big Lunch in Buckinghamshire - as a father praises the 'amazing' siblings for posing for selfies with his disabled children
121,'Low-key' fourth birthday party for Prince Archie at Harry and Meghan's £11 million home in California as his cousins take centre stage at the Coronation
122,"'Meghan, you're not fooling us!': Social media users joke that Duchess of Sussex donned heavy disguise to get into Westminster Abbey (but in fact it was a noted composer whose work was played in the service)"
123,"Happy Birthday, Archie! As the young prince turns four today, a glimpse into his life in California with parents Prince Harry and Meghan Markle"
124,Anti-monarchy activists side with Meghan and call her their 'People's Princess' as they crash Charles's Coronation with #NotMyKing protest
125,British Vogue Editor and Meghan's one-time pal Edward Enninful chats with Katy Perry as he arrives at Westminster Abbey for the Coronation
126,Happy birthday Archie! Royal fans celebrate Prince Harry and Meghan's son as he turns 4 - with Duchess set to throw 'low-key' party in California while her husband attends the Coronation
127,'You can't deal with narcissists like her': Biographer Tom Bower tells PALACE CONFIDENTIAL that King Charles should 'cut the Montecito royals off' and Harry and Meghan should have no role in Britain
128,EXCLUSIVE: Billionaire Michael Bloomberg's daughter Georgina reveals her family is firmly ANTI-Sussex - admitting her British mother would 'never forgive her' if she worked with Prince Harry or Meghan
129,How will Meghan Markle be spending the Coronation? Duchess set to enjoy a 'low-key party' for Archie's fourth birthday at home with mother Doria - and Harry could be 'in and out of the UK within 24 hours' to get back to LA
130,Mirroring Meghan! Kate wears her sister-in-law's signature £490 Aquazzura heels with monochrome dress to Coronation reception
131,"How Donald Trump's support for 'very nice' Meghan soured after Megxit: Ex-President once backed the 'very good American princess' then said he was 'not a fan', called to strip their titles and branded her 'very disrespectful'"
132,Donald Trump blasts Meghan Markle for 'disrespecting' the Queen
133,Donald Trump blasts Meghan Markle for 'disrespecting' the Queen as the ex-US president tells Nigel Farage he's 'surprised' that Prince Harry was invited to his father's coronation
134,Harry and Meghan's biographer Omid Scobie reveals couple had to wait 'for some time' to get confirmation that they were welcome at the Coronation
135,Madame Tussauds Sydney brutally snubs Meghan Markle at unveiling of King Charles' wax figure as she skips his Coronation
136,FASHION FINDER: Are short suits set to be the HOTTEST fashion trend this spring? Everyone from Meghan Markle to Holly Willoughby seems to think so - shop the best items here
137,"DAN WOOTTON: The Hollywood announcement, dramatic makeover and basketball PDA that wasn't… why Meghan's PR stunts are a shameful bid to steal attention from the King in his Coronation week"
138,"The scandalous history of Frogmore Cottage: Prince Harry and Meghan's former home was once the base of Queen Victoria's beloved Indian manservant... until he was thrown out by King Edward VII, who HATED him"
139,Inside Norway's 'Megxit': Princess Martha Louise says stepping down from royal duty was filled with 'turmoil' but reveals King and Queen insist on 'sticking together' as she is quizzed on Harry and Meghan
140,Bank holiday treat! Meghan Markle's ex-BFF Jessica Mulroney dines at the Ivy Asia with her husband Ben and a group of pals after hitting tourist hotspots in London ahead of the Coronation
141,I'm an astrology expert and it's obvious why Meghan Markle is skipping King Charles' coronation
142,What Meghan Markle wrote about 'Princess Kate's wedding' YEARS before she met Prince Harry - and her words were rather scathing
143,"Meghan's first fan! Thomas Markle built the sets for Duchess of Sussex's school musicals, new interview reveals"
