,0
1223,"Meghan Markle's father Thomas Snr (middle with son Tom Jr,right, and daughter Samantha, left), who stayed up all night to watch the ceremony on TV at his home in Rosarito, Mexico, told the Mail on Sunday he believed ‘it was for the best’ that the Duchess stayed at home"
1224,Meghan appears to be looking in Harry's direction as she walks with her husband and suspected bodyguard
1225,"A British photographer renowned for taking photos of the Royal Family revealed on Thursday that Prince Harry's personality changed after marrying Meghan Markle. Arthur Edwards, 82, said on Australia's The Project that Harry was not as outgoing as he used to be"
1226,"Composer Sir Karl Jenkins, 79, took to TikTok to tell Coronation viewers he was not Meghan Markle in disguise and that he has had his moustache since he was 18"
1227,"Meghan looks radiant in this deep red Sentaler belted wrap coat on a visit to Birkenhead in 2019. Here, she has it elegantly belted up against the cold January air"
1228,It's unclear whether Rebel met the Sussexes before or after her BAFTAs speech - but this hasn't stopped Meghan's fans from speculating her joke was to blame for their awkward encounter
1229,"The foursome reunited again following the Queen's death in September 2022.Kate, Prince William and Prince Harry were joined by Meghan for a surprise joint walkabout"
1230,Australian entertainment reporter Peter Ford has unleashed on Meghan Markle for choosing not to attend King Charles III's Coronation. Pictured: The Duke and Duchess of Sussex
1231,Meghan Markle did not attend the Coronation but remained in California to celebrate Archie's birthday. This picture was taken on his first birthday
1232,"Just three days after marrying Prince Harry, Meghan Markle opted for a sleek side bun with a wide-brimmed hat to carry out her first royal engagement as the Duchess of Sussex as she attended a garden party at Buckingham Palace"
1233,"Archie celebrating his first birthday with his mother, Meghan, father, Harry and maternal grandmother Doria"
1234,"Prince Harry and Meghan Markle visit the track and field event at the Invictus Games in The Hague, Netherlands, April 17, 2022"
1235,"Prince Harry and Meghan Markle announcing their engagement in Kensington Palace, London, in November 2017"
1236,Harry and Meghan (pictured shortly after the Queen's death in September) stepped back from royal duties in 2020
1237,"Prince Harry and Meghan Markle took the phrase 'keep calm and carry on' to new levels last night when they stepped out for a date night at a $4,200-a-year private members club in LA - as it was reported they're being 'evicted' from Frogmore Cottage"
1238,"Holly and Phil presenting This Morning on Thursday, where they opened the show with a discussion about Harry and Meghan"
1239,"In a section of the book entitled 'The captain of my soul', Prince Harry writes about the first moment he sees Meghan - on a friend's Instagram page, using a dog filter (pictured in a different clip using a similar filter)"
1240,"Prince Andrew, Princess Beatrice, Princess Eugenie, Harry and Meghan are not expected to participate"
1241,"Holly and Phil presenting This Morning today, where they opened the show with a discussion about Harry and Meghan"
1242,William and Harry are pictured on their way to the church. It was reported that Meghan was in an Airbnb getting ready for the reception later on
1243,The social media star says she first started being told she looked like Meghan when the Duchess began dating Prince Harry in 2016
1244,"Britain's Prince Harry, Duke of Sussex (L) and Prince Harry's brother and best man Prince William, Duke of Cambridge wait in the chapel ahead of his wedding to US actress Meghan Markle at St George's Chapel, Windsor Castle, in Windsor, on May 19, 2018"
1245,"Prince Harry, 38, recounted that he first saw Meghan in a video where she used the social media filter with his friendViolet Von Westenholz. Pictured: a similar snap of Meghan"
1246,Carla Bruni has been slammed for posting an edited photo of Prince Harry which replaces Meghan Markle with Yoko Ono
1247,"Light accessories:Meghann let her magnificent dress do most of the talking, and accessorized lightly, wearing a pair of silver earrings and one silver ring"
1248,"Harry and Meghan have not yet decided whether they will attend the coronation, a source has said"
1249,"In a dramatic change of heart, Meghan sprinted down the hallway to tell Jakob she had changed her mind"
1250,Meghan wore a loose black shirt and matching shorts at the Peninsula Hotel in 2009
1251,"Harry and Meghan aren't the first royal couple to consider leaving the UK, with Harry's cousin Zara Tindall revealing in 2019 she and her husband Mike were thinking about moving their family the Australia. (The Tindalls are pictured in Byron Bay, NSW, earlier this week)"
1252,"A new book contains revelations about Meghan and Harry, including their wedding in 2018"
1253,"The second 'good omen' occurred during a trip to the Castle of Mey in Scotland (pictured), when Harry says a group of seals began serenading his 'magic' wife Meghan"
1254,"As Prince Andrew ponders his strategy to discredit Virginia Giuffre’s recollections, might he seek inspiration from nephew Harry’s account of Meghan’s first meeting with the Queen, when she asked Harry to identify HM’s ‘assistant’?"
1255,CNN Royal Correspondent Max Foster said the Palace must respond now to the 'very serious' allegations made by Harry and Meghan in the new episodes
1256,"It depicted Meghan as a 'sorority girl, actress, influencer and victim' and also described her as a 'First Lady botherer', seemingly taking aim at her relationship with Michelle Obama"
1257,Meghann Fahy went for a more decorated approach to the all-white look
1258,The CCTV footage posted by Hertforshire Police on Facebook was later shared by the Facebook group UK Cop Humour who captioned it: 'Rare footage of Prince Harry without Meghan has emerged'
1259,The mother-of-two has previously spoken to media on a number of occasions in her role as a Meghan Markle lookalike
1260,Meghan and Harry were seen clapping and cheering as Harry stares intently during thethird quarter of the NBA playoffs round
1261,Kathryn Drysdale stars as Meghan Markle inChannel 4¿s parody sitcom The Windsors
1262,"Harry and Meghan’s endless, irony-free lectures on topics such as climate change, female oppression and unconscious bias are increasingly falling on deaf ears"
1263,"Despite her concerns, the casting directors asked Meghan back to meet the studio and network bosses. She went on to successfully star in the programme as Rachel Zane from 2011 to 2018"
1264,Meghan had just finished an audition for a television show pilot called A Legal Mind - later to become known as Suits. Pictured: Meghan playing a nurse in the television show General Hospital
1265,"Harry had long been expected to swiftly return to his wife Meghan Markle in Montecito so they could celebrate the birthday of their son Archie, who turned four on Saturday"
1266,"Business on top, party down below: Meghan wore a £595 pink linen suit to attend a basketball game in LA with her husband last week"
1267,"It was said by a source close to the couple that Meghan was 'more wary' about the extremely personal memoir than the prince was, adding she may have raised 'gentle concerns'"
1268,"Prince William previously played in charity polo matches with his brother Prince Harry, who now lives in his $14.7million home in Santa Barbara with wife Meghan Markle, son Archie, and daughter Lilibet Diana"
1269,"However, while Edward deftly bridged the conversation gap between the Sussexes and the then Duke and Duchess of Cambridge , who were seated on the row in front, his wife Sophie appeared to largely avoid chatting to Meghan and Harry"
1270,Meghan is known for her love of neutral colours and expensive designer pieces (pictured in May 2018)
1271,Prince Harry was given a platinum band with a textured finish during his wedding to Meghan Markle in 2018
1272,"Rock made jokes about Meghan and Prince Harry during his set, specifically regarding their interview with Oprah"
1273,Prince Harry and Meghan Markle
1274,"Meghan's father Thomas Markle, 78, who is still recovering from a stroke, is then seen pleading: 'How do I fix this?'"
1275,The humble three-bedroom abode is located at 279 Santa Rosa Lane - just a short drive from the $14.65 million mansion where Meghan and Harry currently reside with their two children
1276,Mr Morgan left ITV's Good Morning Britain in March 2021 after saying he 'didn't believe a word' Meghan Markle told Oprah Winfrey about her mental health in her bombshell sitdown
1277,It could further fuel rumours that Meghan has political ambitions given her outspoken views on women's rights and other issues
1278,Talented:Theo and his on-screen wife Meghann Fahy looked stylish while attending the AFI Awards Luncheon in Los Angeles on Friday afternoon
1279,"Prince Harry is forming plans to return to Africa without Meghan Markle (pictured in Cape Town in 2019) for a new Netflix documentary, according to Page Six"
1280,Harry described the interior Clarence House while describing the introduction between Meghan Markle and the King and Queen Consort
1281,"Prince Harry has revealed the two 'good omens' that he spotted while he and Meghan Markle were trying to conceive their first child, Archie (seen together in February 2019)"
1282,"Meghansported brown canvas shorts, a crisp white button down shirt, flat sandals, large dark sunglasses and straw fedora for the outing"
1283,"Queen Camilla has raised eyebrows after wearing a Dior dress to Royal Ascot, amid speculation Meghan Markle was turned down from collaborating with the brand"
1284,Harry writes that Meghan made the comment during the run up to the Sussexes' wedding in May 2018. Meghan is pictured with Kate here in 2018 at an event in London
1285,Prince Harry and Meghan previously live in Frogmore Cottage (pictured inside the cottage)
1286,Piers Morgan quit ITV's Good Morning Britain following a row about comments he made about Meghan Markle
1287,"From helping her choose her dress to coordinating plans, Jessica was a key player at Meghan and Harry's 2018 wedding, and both her sons and daughter were even involved in the celebration"
1288,HER STUDY:Meghan offered fans a rare glimpse inside the Californian mansion she shares with Prince Harry today during a 'special message' shared on her 40th birthday
1289,"Harry and Meghan had been given the use of the cottage by Harry's grandmother, Queen Elizabeth, in 2018 as their relationship with the Duke and Duchess of Cambridge unravelled"
1290,"In suits Meghan Markle (right) played Rachel Zane, the love interest of Patrick J. Adams' character Michael Ross (left)"
1291,Prince Harry and Meghan Markle released a statement following news of Princess Lilibet Diana's christening that the princely titles were the 'birthright' of their children. Pictured: The Duke and Duchess of Sussex in 2019 in Cape Town with Prince Archie of Sussex
1292,"A talent agency that recently signed Meghan, WME, told the Wall Street Journal that she was still hoping to find new outlets for her work"
1293,"In recognition of Mental Health Awareness Month, Prince Harry and Meghan visited a youth group this week"
1294,"'Her behaviour this past week, seemingly designed to deliberately divert attention from the Coronation thanks to her ¿Me Me Meghan¿ Hollywood sideshow, is not the behaviour of an icon, but a fallen star,' writes Dan Wootton (pictured)"
1295,"Meghan Markle leaving her home in Toronto, Canada"
1296,Radiant: Haley Lu's co-star Meghann Fahy flashed her cleavage in head-to-toe black
1297,Meghan Markle's Archetypes series has ended with no clue yet if there will be a second series of the show
1298,Suspicion: Meghan and Jean claimed to be at Boston Children's Hospital receiving radon therapy - but they were later traced to a luxury hotel in Florida
1299,Harry and his wife Meghan appeared in a six-episode docuseries on Netflix
1300,"A TikTok clip posted in April last year saw barista @Meghannesium, thought to be from the US, and identifying as a transgender woman, claim she was misgendered while working at Starbucks"
1301,Harry and Meghan are understood to be keen to not deny their children their titles but to allow them the chance to decide for themselves when older
1302,It comes after an insider told Mail On Sunday Princess Eugenie and her husband Jack could be about to do their own Megxit as they may be considering following Prince Harry and Meghan to sunny California after the birth of their second child
1303,It has been speculated that Prince Harry and Meghan Markle expected to have more support from their Hollywood friends when they moved to California three years ago
1304,"Meghan Trainor (pictured) is currently staying in Australia while she appears as a judge on Channel Seven's Australian Idol. Pictured with husband Daryl Sabara, 30"
1305,Mr Whittock (pictured with a Meghan lookalike) has been playing Prince Harry at events since 2017 and was even voted 'Lookalike of the Year' by easyJet
1306,Omid Scobie claimed Meghan was 'disappointed' that Kate didn't offer a 'stronger shoulder of support'
1307,Meghan opted for a radiant makeup palette to enhance her glowing complexion and she added touches of glamour to her look with statement silver jewellery
1308,"Royal Lodge is in Windsor Great Park. Some senior members of the Royal Family hope Andrew will agree to move to Frogmore Cottage close to Windsor Castle, now that Harry and Meghan have moved out"
1309,Meghan Markle paid a subtle tribute to her late mother-in-law Princess Diana by carrying a Dior bag named after her when she attended the Global Citizen Live event in New York
1310,Meghan Markle and Prince Harry with baby Archie in 2018
1311,"Although it is unclear what photos Harry has framed, he and Meghan shared several candid snaps from their private life during their bombshell Netflix documentary last month"
1312,"When he and his brother began arguing about Meghan, Harry claims William was not being rational, leading to a shouting match. Pictured: Harry and Meghan in their latest Netflix documentary"
1313,"Eliza, Louis, Victoria Lockwood and Kitty are pictured attending the wedding of Prince Harry and Meghan Markle"
1314,"Publicist Lynne Franks said she feared the fall-out from the book would affect the Games, the international sporting competition for injured, wounded and sick veterans founded by Harry in 2014. Prince Harry and Meghan Markle attend the games in the Netherlands in 2022"
1315,"Meghan started the website while she was starring in the USA drama Suits and named it after her favorite type of wine, Tignanello"
1316,"Prince Harry will be flying in from Montecito, California, leaving behind his wife Meghan Markle and their two children Archie and Lilibet (pictured together)"
1317,LORD ASHCROFT: We found people in Britain less likely to sympathise with Harry and Meghan than with the King and Prince William
1318,Dramatic outerwear: Meghann Fahy attended the event in a black bra top and flared trousers that cascaded around her legs
1319,"Beaming:Leo,Meghann and Will flashed delighted smiles following the win"
1320,Prince Harry walks alongside Meghan and the Princess of Wales at the lying-in-state of the Queen last year
1321,The Princess of Wales and Duchess of Sussex pictured at the Wimbledon women's singles final in 2018. Prince Harry says William called Meghan 'rude' for accusing his wife of having 'baby brain'
1322,Prince Harry and Meghan Markle pictured with the late Queen at Princess Eugenie's wedding in October 2018. The couple announced the pregnancy at a cocktail party after the ceremony
1323,"In his memoir Spare, the Duke of Sussex, 38, recounts the very passionate way in which he and Meghan reunited in London after spending weeks apart in the summer of 2016"
1324,Meghan Markle pictured in season seven of Suits in 2017 - before she left the show to marry Prince Harry
1325,Susanna Reid and Richard Madeley (pictured) witnessed an explosive row over Harry and Meghan between two broadcasters
1326,"Among the companies inked by Meyer and Genow are two publishing firms. The first, Peca Publishing LLC, was set up in September 2020 and used by Meghan to hold the rights for her kids book The Bench. Peca is Spanish for freckle, and appears to be a reference to a book Meghan wrote in eighth grade titled A Face Without Freckles... Is a Night Without Stars"
1327,Harry reveals tension was brewing between Kate Middleton and Meghan Markle from the beginning (pictured at Trooping the Color in 2018) as Meghan's joke left a 'yawning silence'
1328,"The King may have opted to grant his youngest son's children use of their titles - but the move comes in sharp contrast to another European monarch's decisions in recent months (pictured, Prince Harry with Meghan Markle, Archie and Lilibet)"
1329,Former politician-turned-radio host Scott Emerson called Prince Harry (right) and Meghan Markle (left) 'the ginger and the whinger' on Nine's Today show on Monday
1330,"Meghan, 41, chose a design from Colombian brand Johanna Ortiz (seen), but opted to have the $1,850 Ideal Universe Midi Dress altered to remove the straps"
1331,Things between the wives became seriously tricky in the days leading up to Harry and Meghan's wedding in May 2018
1332,"Yet isn't it strange that the Sussexes failed to honour any of Meghan's family in the name, in particular her mum Doria who's played such an important role in her life? After all, they've hurled accusations worldwide about the horrible Royal Family, accusing them of racism, of being cold, uncaring and of freezing out Meghan and forcing them to flee the country"
1333,"It's clear Harry was never properly prepared for the rigors of the adult world.But as for plain old Meghan: what ever happened to the hard-working actress who was raised on $4.99 salads, who took ¿all the odds-and-ends jobs¿ to help pay the bills?"
1334,King Charles didn't appear to hear the student's comments at first and had to be told by an aide what they had shouted. Prince Harry and Meghan Markle pictured in October 2018
1335,Meghan pictured on set in Suits with actor Rick Hoffman. Harry admitted to looking up her X-rated scenes online whilst they were dating
1336,Bradby's ITV documentary in South Africa in 2019 also saw Meghan Markle tell him: 'Not many people have asked if I'm okay'
1337,"Ex: Meghan also had her own experience with divorce, splitting from her first husbandTrevor Engelson in 2014"
1338,Meghan Markle looked happy as she left the Crypto.com Arena after a night watching the LA Lakers with her British husband
1339,Prince Harry saw the Princess of Wales as the sister he 'never had' - but has accused his family of 'stereotyping' his wife Meghan Markle. Above: Harry stands next to Kate and his brother on the Buckingham Palace balcony in 2013
1340,"Sarah Mhlanga, from Cheshire ,who appeared on Love it or List it used to be a Meghan Markle lookalike and regularly gave interviews to media about their similarities"
1341,"While launching her jewelry line, Kayla Jaclyne, the 23-year-old heiress said she wouldn't want Meghan, 41, as a model because she 'couldn't take that chance' on such a contentious figure"
1342,Meghan joked that the event was 'colourful' at one of her first public appearances with Prince Harry as newly weds
1343,"Firefighters clear away a fallen tree in Montecito, California, the village home to many celebrities, including Prince Harry and Meghan Markle"
1344,"The late Queen Elizabeth II, Charles, Camilla, William, Kate, Harry and Meghan attend the Commonwealth Day Service at Westminster Abbey on March 9, 2020"
1345,Giggling Duchess! Meghan smiled coyly as Harry leaned in to whisper something in her ear in the public display of affection
1346,Misha Nonoo and her ex-husband Alexander Gilkes pictured at the11th annual CFDA/Vogue Fashion Fund Awards in November 2014. The fashion designer met Meghan in May that year
1347,"Beatricehas known Meghan's BFF Misha for years, and attended her wedding to ex-husband Alexander Gilkes' in 2012 alongside her sister Princess Eugenie (right, Misha and Meghan together in 2015)"
1348,It comes amid rumours that Meghan will relaunch her health and wellness blog The Tig - which would rival the likes of Gwynth Paltrow's lifestyle brand Goop
1349,Meghan Markle'senthusiastic adoption of her husband’s status while mocking the family that bequeathed it upon him continues to antagonise many
1350,"Meghan long had a reputation as a diva, even as a C-list actress in the moderately successful US drama Suits, writes Dan Wootton. Pictured:Meghan, The Duchess of Sussex, surrounded by a female Police Protection officer and heavy Fijian security officers as she visits Suva Market, Fiji, in 2018"
1351,"Amazing: Meghan Fahy showed off her impeccable style in a quirky black leather top, teamed with trousers and heels"
1352,"Harry and Meghan during a visit to Auwal Mosque, the oldest mosque in Cape Town, 2019"
1353,"Harry & Meghan ranked second behind the Tinder Swindler,the story of conman Shimon Hayut (pictured)"
1354,Prince Harry's wedding to Meghan Markle in May 2018 cost the taxpayer in excess of £30m
1355,"Author Kehinde Andrews (above), who appeared on the Sussexes' Netflix series, called Harry and Meghan 'celebrities' and compared the feud within the family to soap opera EastEnders"
1356,"She lived with her husband in Frogmore Cottage, which would later become home to Prince Harry and Meghan Markle"
1357,"Back in September, Meghan revealed she was trying to get pregnant with twins and could even conceive them Down Under"
1358,Meghan says it took a year for her jaw to settle down again following the eight-hour double jaw surgery
1359,"Along with Meghan Markle and her mother, Princess Anne, Zara Tindall stands at 5'6"
1360,Meghan had reportedly raised 'gentle concerns' about Harry's decision to release Spare and was worried if it was the right move
1361,"The 56-year-old is suing Meghan, 41, for £60,000 in damages, claiming her reputation was left in tatters after her sister spread 'malicious lies' in her 2021 Oprah interview"
1362,Look of love: Meghan's oldest son kept a close eye on his baby brother
1363,Meghan opted for a sparkly minidress
1364,Meghan wore a Valentino suit for the Invictus Games in The Hague last year
1365,"The 20th century predecessors of Prince Harry and Meghan, Princess Mira and her husband PrinceDmitri Alexandrovich moved into Frogmore Cottage"
1366,"King Charles, who had told Harry early into his relationship with Meghan that he couldn¿t afford to support them, stopped taking his son¿s calls after he was sworn at and asked for money. Pictured:Meghan, a then Prince Charles, and Harry on the balcony of Buckingham Palace on June 9, 2018"
1367,"When she was bornLili weighed 7lbs 11oz, almost the exact same as her cousin Mia Tindall, with the announcement of her birth being made by Meghan's press secretary on June 6. Pictured: A photo of Princess Lili on her first birthday"
1368,"That at least was what they used to say; what many in the fashion industry concluded when, after being appointed editor of British Vogue, Enninful outlined his vision for the world's most glamorous magazine (pictured: Enninful with Meghan, Duchess of Sussex)"
1369,"Meghan's favorability has plunged 36 percentage points, per Newsweek"
1370,"Princess Camilla's approval falls lower than dejected royals, Prince Harry and Princess Meghan (both pictured), who only have nine per cent approval in the UK"
1371,"One section of the book claims that Harry was 'knocked to the floor' by his brother William in a furious row over his wife Meghan Markle, with the Duke saying he was injured when a dog bowl shattered underneath him. The bowl may have belonged to Pula (pictured with Harry in California yesterday), who was adopted in 2018"
1372,Meghan said the comment over Archie's skin was not made with malice. But a source told the Daily Telegraph that the duchess will not attend the Coronation on May 6 because she received an unsatisfactory response from the King (pictured with the King and Queen Consort in Mary 2018)
1373,"Barr (left, with The Sun's royal correspondent Emily Andrews) said the Royal Family risks an own goal by allowing Harry and Meghan to return to the fold for the ceremony on May 6, because they could head back to California with fresh material for their ongoing smear campaign against The Firm"
1374,"Harrison Colcord is the latest recruit to Harry and Meghan's office, it has emerged"
1375,Meghan Markle wrapped up warm in a front tie wrap coat by British designer Stella McCartney when she visited Cardiff Castle with Prince Harry in January 2018
1376,Meghan touches Harry's knee as she leaves her seat
1377,"The Princess of Wales, pictured on Easter Sunday with Prince Louis, would have been 'particularly uncomfortable' if Meghan had attended the Coronation, a royal observer has claimed"
1378,The King is thought to believe that Harry and Meghan's absence at his coronation would be a greater distraction than their presence
1379,"Meghan's first film premiere as a royal was to attend a screening of The Lion King, the live-action remake of the classic 1990s film, where she was introduced to Beyonce and Jay-Z"
1380,When Meghan Markle posted for Gritty Pretty in 2015 - the photos were then re-used in Elle France two years later - many noticed that her face looked suspiciously freckle free
1381,"Bad boy on set: Woodall played a rent-boy henchman who helps con Jennifer's doomed heiress by seducing her hapless assistant. While he didn't have any scenes with Meghann's character on The White Lotus, it certainly appears that they had a great time together off set"
1382,Meghan had paid tribute to the other honourees for their 'important and meaningful work'
